"GY56FLIS","journalArticle","2014","Pütten, Astrid M. Rosenthal-von der; Schulte, Frank P.; Eimler, Sabrina C.; Sobieraj, Sabrina; Hoffmann, Laura; Maderwald, Stefan; Brand, Matthias; Krämer, Nicole C.","Investigations on empathy towards humans and robots using fMRI","Computers in Human Behavior","","0747-5632","https://doi.org/10.1016/j.chb.2014.01.004","https://www.sciencedirect.com/science/article/pii/S0747563214000090","Although robots are starting to enter into our professional and private lives, little is known about the emotional effects they elicit. In line with the Media Equation, humans may react towards robots as they do towards humans, making it all the more important to carefully investigate the preconditions and consequences of contact with robots. Based on assumptions on the socialness of reactions towards robots, we conducted a study that provides further insights into the question of whether humans show emotional reactions towards a robot and whether these reactions differ from those towards a human. To explore emotionality in human–robot interaction we conducted an fMRI study (n=14). Participants were presented videos showing a human, a robot and an inanimate object, being treated in either an affectionate or in a violent way. Self-reported emotional states and functional imaging data revealed that participants indeed reacted emotionally when seeing the affectionate and violent videos. While no different neural activation patterns emerged for the affectionate interaction towards both, the robot and the human, we found differences in neural activity when comparing only the videos showing abusive behavior indicating that participants experience more emotional distress and show negative empathetic concern for the human in the abuse condition. This was supported by similar findings with regard to participant’s self-reported emotional states.","2014","2021-02-15 21:45:53","2021-02-15 21:45:53","","201-212","","","33","","","","","","","","","","","","","","","","","","","","","Functional magnetic resonance imaging; Empathy; Experimental study; Psychophysiological measures; Human–robot interaction","","","","","","","","","","","","","","","","","","","","","","","","","","","","","","","","","","","","","","","","","","","","","","",""
"INEZ6HT2","journalArticle","2020","Ionta, Silvio; Costantini, Marcello; Ferretti, Antonio; Galati, Gaspare; Romani, Gian Luca; Aglioti, Salvatore M.","Visual similarity and psychological closeness are neurally dissociable in the brain response to vicarious pain","Cortex","","0010-9452","https://doi.org/10.1016/j.cortex.2020.09.028","https://www.sciencedirect.com/science/article/pii/S0010945220303737","Personal and vicarious experience of pain activate partially overlapping brain networks. This brain activity is further modulated by low- and high-order factors, e.g., the perceived intensity of the model's pain and the model's similarity with the onlooker, respectively. We investigated which specific aspect of similarity modulates such empathic reactivity, focusing on the potential differentiation between visual similarity and psychological closeness between the onlooker and different types of models. To this aim, we recorded fMRI data in neurotypical participants who observed painful and tactile stimuli delivered to an adult human hand, a baby human hand, a puppy dog paw, and an anthropomorphic robotic hand. The interaction between type of vicarious experience (pain, touch) and nature of model (adult, baby, dog, robot) showed that the right supramarginal gyrus (rSMG) was selectively active for visual similarity (more active during vicarious pain for the adult and baby models), while the anterior cingulate cortex (ACC) was more sensitive to psychological closeness (specifically linked to vicarious pain for the baby model). These findings indicate that visual similarity and psychological closeness between onlooker and model differentially affect the activity of brain regions specifically implied in encoding interindividual sharing of sensorimotor and affective aspects of vicarious pain, respectively.","2020","2021-02-15 21:45:53","2021-02-15 21:45:53","","295-308","","","133","","","","","","","","","","","","","","","","","","","","","fMRI; Empathy; Pain; Affective; Sensorimotor","","","","","","","","","","","","","","","","","","","","","","","","","","","","","","","","","","","","","","","","","","","","","","",""
"988I9E8G","journalArticle","2020","Barnett, Anthony; Savic, Michael; Pienaar, Kiran; Carter, Adrian; Warren, Narelle; Sandral, Emma; Manning, Victoria; Lubman, Dan I.","Enacting ‘more-than-human’ care: Clients’ and counsellors’ views on the multiple affordances of chatbots in alcohol and other drug counselling","International Journal of Drug Policy","","09553959","10.1016/j.drugpo.2020.102910","https://linkinghub.elsevier.com/retrieve/pii/S0955395920302498","Forms of artificial intelligence (AI), such as chatbots that provide automated online counselling, promise to revolutionise alcohol and other drug treatment. Although the replacement of human counsellors remains a speculative prospect, chatbots for ‘narrow AI’ tasks (e.g., assessment and referral) are increasingly being used to augment clinical practice. Little research has addressed the possibilities for care that chatbots may generate in the future, particularly in the context of alcohol and other drug counselling. To explore these issues, we draw on the concept of technological ‘affordances’ and identify the range of possibilities for care that emerging chatbot interventions may afford and foreclose depending on the contexts in which they are implemented. Our analysis is based on qualitative data from interviews with clients (n=20) and focus group discussions with counsellors (n=8) conducted as part of a larger study of an Australian online alcohol and other drug counselling service. Both clients and counsellors expressed a concern that chatbot interventions lacked a ‘human’ element, which they valued in empathic care encounters. Most clients reported that they would share less information with a chatbot than a human counsellor, and they viewed this as constraining care. However, clients and counsellors suggested that the use of narrow AI might afford possibilities for performing discrete tasks, such as screening, triage or referral. In the context of what we refer to as ‘more-than-human’ care, our findings reveal complex views about the types of affordances that chatbots may produce and foreclose in online care encounters. We conclude by discussing implications for the potential ‘addiction futures’ and care trajectories that AI technologies offer, focussing on how they might inform alcohol and other drug policy, and the design of digital healthcare.","2020-10","2021-02-15 21:48:48","2021-02-15 21:48:48","2021-02-15 21:48:48","102910","","","","","International Journal of Drug Policy","Enacting ‘more-than-human’ care","","","","","","","en","","","","","DOI.org (Crossref)","","","","C:\Users\esben\Zotero\storage\VBFNEFR8\Barnett et al. - 2020 - Enacting ‘more-than-human’ care Clients’ and coun.pdf","","","","","","","","","","","","","","","","","","","","","","","","","","","","","","","","","","","","","","","","","","","","","","","","",""
"2W85QYR4","journalArticle","2017","Karamshuk, Dmytro; Shaw, Frances; Brownlie, Julie; Sastry, Nishanth","Bridging big data and qualitative methods in the social sciences: A case study of Twitter responses to high profile deaths by suicide","Online Social Networks and Media","","2468-6964","https://doi.org/10.1016/j.osnem.2017.01.002","https://www.sciencedirect.com/science/article/pii/S2468696416300076","With the rise of social media, a vast amount of new primary research material has become available to social scientists, but the sheer volume and variety of this make it difficult to access through the traditional approaches: close reading and nuanced interpretations of manual qualitative coding and analysis. This paper sets out to bridge the gap by developing semi-automated replacements for manual coding through a mixture of crowdsourcing and machine learning, seeded by the development of a careful manual coding scheme from a small sample of data. To show the promise of this approach, we attempt to create a nuanced categorisation of responses on Twitter to several recent high profile deaths by suicide. Through these, we show that it is possible to code automatically across a large dataset to a high degree of accuracy (71%), and discuss the broader possibilities and pitfalls of using Big Data methods for Social Science.","2017","2021-02-15 21:49:29","2021-02-15 21:49:29","","33-43","","","1","","","","","","","","","","","","","","","","","","","","","Natural language processing; Crowd-sourcing; Crowdflower; Emotional distress; High-profile suicides; Public empathy; Social media; Social science","","","","","","","","","","","","","","","","","","","","","","","","","","","","","","","","","","","","","","","","","","","","","","",""
"RWV477TJ","journalArticle","2018","Bogatyreva, Anastasia A.; Sovkov, Andrei D.; Tikhomirova, Svetlana A.; Vinogradova, Anna R.; Samsonovich, Alexei V.","Virtual pet powered by a socially-emotional BICA","Procedia Computer Science","","1877-0509","https://doi.org/10.1016/j.procs.2018.11.101","https://www.sciencedirect.com/science/article/pii/S1877050918323895","Cognitive architectures are used to build intelligent agents, and nowadays special attention in this area is drawn to emotion modelling. The purpose of this study is to compare two models describing social-emotional behavior, one of which is based on a traditional machine learning algorithm, and the other on a cognitive architecture supporting social emotionality. It is hypothesized that the second model will be more efficient in eliciting user's empathy to a virtual cobot based on this model. Here the object of study is a virtual pet: a penguin. Two models controlling the pet were compared: a reinforcement learning model (a Q-learning algorithm) and the emotional cognitive architecture eBICA (Samsonovich, 2013). The second approach was based on a semantic map of pet's emotional states, that was constructed based on the human ranking. It is found that the eBICA model scores higher in participant's empathy compared to the model based on reinforcement learning. This article compares strengths and weaknesses of both methods. In conclusion, the findings indicate advantages of the approach based on eBICA compared to more traditional techniques. Results will have broad implications for building intelligent social agents.","2018","2021-02-15 21:49:29","2021-02-15 21:49:29","","564-571","","","145","","","","","","","","","","","","","","","","","","<p>Postproceedings of the 9th Annual International Conference on Biologically Inspired Cognitive Architectures, BICA 2018 (Ninth Annual Meeting of the BICA Society), held August 22-24, 2018 in Prague, Czech Republic</p>","","","emotional intelligence; virtual character; cognitive architecture; reinforcement learning; semantic space","","","","","","","","","","","","","","","","","","","","","","","","","","","","","","","","","","","","","","","","","","","","","","",""
"37VH3W2F","journalArticle","2021","Park, Jihyun; Jindal, Abhishek; Kuo, Patty; Tanana, Michael; Lafata, Jennifer Elston; Tai-Seale, Ming; Atkins, David C.; Imel, Zac E.; Smyth, Padhraic","Automated rating of patient and physician emotion in primary care visits","Patient Education and Counseling","","0738-3991","https://doi.org/10.1016/j.pec.2021.01.004","https://www.sciencedirect.com/science/article/pii/S0738399121000045","Objective Train machine learning models that automatically predict emotional valence of patient and physician in primary care visits. Methods Using transcripts from 353 primary care office visits with 350 patients and 84 physicians (Cook, 2002 [1], Tai-Seale et al., 2015 [2]), we developed two machine learning models (a recurrent neural network with a hierarchical structure and a logistic regression classifier) to recognize the emotional valence (positive, negative, neutral) (Posner et al., 2005 [3]) of each utterance. We examined the agreement of human-generated ratings of emotional valence with machine learning model ratings of emotion. Results The agreement of emotion ratings from the recurrent neural network model with human ratings was comparable to that of human-human inter-rater agreement. The weighted-average of the correlation coefficients for the recurrent neural network model with human raters was 0.60, and the human rater agreement was also 0.60. Conclusions The recurrent neural network model predicted the emotional valence of patients and physicians in primary care visits with similar reliability as human raters. Practice implications As the first machine learning-based evaluation of emotion recognition in primary care visit conversations, our work provides valuable baselines for future applications that might help monitor patient emotional signals, supporting physicians in empathic communication, or examining the role of emotion in patient-centered care.","2021","2021-02-15 21:49:29","2021-02-15 21:49:29","","","","","","","","","","","","","","","","","","","","","","","","","","Machine learning; Sentiment analysis; Natural language processing; Doctor-patient communication; Doctor-patient conversation; Emotion classification; Patient-physician communication; Primary care visit","","","","","","","","","","","","","","","","","","","","","","","","","","","","","","","","","","","","","","","","","","","","","","",""
"VBBBA2FU","journalArticle","2020","Doraiswamy, P. Murali; Blease, Charlotte; Bodner, Kaylee","Artificial intelligence and the future of psychiatry: Insights from a global physician survey","Artificial Intelligence in Medicine","","0933-3657","https://doi.org/10.1016/j.artmed.2019.101753","https://www.sciencedirect.com/science/article/pii/S0933365719306505","Background Futurists have predicted that new autonomous technologies, embedded with artificial intelligence (AI) and machine learning (ML), will lead to substantial job losses in many sectors disrupting many aspects of healthcare. Mental health appears ripe for such disruption given the global illness burden, stigma, and shortage of care providers. Objective To characterize the global psychiatrist community’s opinion regarding the potential of future autonomous technology (referred to here as AI/ML) to replace key tasks carried out in mental health practice. Design Cross sectional, random stratified sample of psychiatrists registered with Sermo, a global networking platform open to verified and licensed physicians. Main outcome measures We measured opinions about the likelihood that AI/ML tools would be able to fully replace – not just assist – the average psychiatrist in performing 10 key psychiatric tasks. Among those who considered replacement likely, we measured opinions about how many years from now such a capacity might emerge. We also measured psychiatrist’s perceptions about whether benefits of AI/ML would outweigh the risks. Results Survey respondents were 791 psychiatrists from 22 countries representing North America, South America, Europe and Asia-Pacific. Only 3.8 % of respondents felt it was likely that future technology would make their jobs obsolete and only 17 % felt that future AI/ML was likely to replace a human clinician for providing empathetic care. Documenting and updating medical records (75 %) and synthesizing information (54 %) were the two tasks where a majority predicted that AI/ML could fully replace human psychiatrists. Female- and US-based doctors were more uncertain that the benefits of AI would outweigh risks than male- and non-US doctors, respectively. Around one in 2 psychiatrists did however predict that their jobs would be substantially changed by AI/ML. Conclusions Our findings provide compelling insights into how physicians think about AI/ML which in turn may help us better integrate technology and reskill doctors to enhance mental health care.","2020","2021-02-15 21:49:29","2021-02-15 21:49:29","","101753","","","102","","","","","","","","","","","","","","","","","","","","","Deep learning; Empathy; Autonomous agents; Mental health","","","","","","","","","","","","","","","","","","","","","","","","","","","","","","","","","","","","","","","","","","","","","","",""
"2L5BCMVA","journalArticle","2012","Roxburgh, Michelle; Conlon, Margaret; Banks, Debbie","Evaluating Hub and Spoke models of practice learning in Scotland, UK: A multiple case study approach","Nurse Education Today","","0260-6917","https://doi.org/10.1016/j.nedt.2012.05.004","https://www.sciencedirect.com/science/article/pii/S0260691712001347","Summary Background Most of UK students' practice learning experience is based on a rotational placement model which often leads to students lacking confidence and feeling anxious about the complexities of the care environment. Objectives To evaluate the impact of Hub and Spoke model(s) of clinical practice placement across geographically diverse locations, with a particular focus on enhancing the student practice learning experience. Design Multiple case study design. Setting & Participants Comprised undergraduate student nurses from Adult, Learning Disability and Mental Health programmes from 3 Scottish Schools of Nursing. Methods A mixed methods approach which included quantitative and qualitative date tools. Results All three Hub and Spoke models shared two broad findings:1)In the three Hub and Spoke models detailed in this paper, there is a continuum of student led learning which supports the process with opportunities for individual students to be positively innovative and creative in their learning approaches. Depth of learning was achieved in two ways; a) the method in which Hub placements are organised, managed and structured and, b) the depth of empathy and sensitivity to the individual at the centre of the care.2)Placement capacity is increased: The classification of placements is reviewed to produce broader categories, Engagement of mentors/enhanced student/mentor relationship. Conclusions Practice Learning must be seen as an academic endeavour that promotes deep, meaningful, person-centred learning rather than superficial, compartmentalised placement-centred learning.","2012","2021-02-15 21:49:58","2021-02-15 21:49:58","","782-789","","7","32","","","","","","","","","","","","","","","","","","<p>Selected papers from NET2011: The 22nd International Networking for Healthcare Education Conference, 6-8 September, 2011, Cambridge, UK</p>","","","Belongingness; Learning environments; Practice Learning","","","","","","","","","","","","","","","","","","","","","","","","","","","","","","","","","","","","","","","","","","","","","","",""
"NHJIJEKL","journalArticle","2019","Petty, Julia; Jarvis, Joy; Thomas, Rebecca","Listening to the parent voice to inform person-centred neonatal care","Journal of Neonatal Nursing","","1355-1841","https://doi.org/10.1016/j.jnn.2019.01.005","https://www.sciencedirect.com/science/article/pii/S1355184118302138","Family integrated care (FIC), where parents are an integral part of their baby's care and decision-making can enhance parental involvement and empowerment, contributing to decreased parental separation and stress. It follows that parents can also be a central part of neonatal education for staff in the neonatal speciality. This paper focuses on what students and staff can learn from parents about what they feel is important to make their experience better. A narrative, interpretive approach was undertaken to collect and analyse parent interview narratives. A specific question was posed to a purposive sample of parents who have had premature babies about what health professionals can learn from them. Thematic analysis revealed five key themes relating to the importance of: communicating; listening; empathising; acknowledging (the parent's role); realising (what matters to parents). These elements were incorporated into a framework named by the mnemonic, ‘CLEAR’. This highlights what parents want staff to be cognisant of when caring for them and their babies. Learning from the parents in our care enables a greater understanding of their experiences at difficult and challenging times. Having a deeper understanding of parents' experiences can contribute to enhanced empathic learning.","2019","2021-02-15 21:49:58","2021-02-15 21:49:58","","121-126","","3","25","","","","","","","","","","","","","","","","","","","","","Family-integrated learning; Narrative inquiry; Neonatal education; Parent experience","","","","","","","","","","","","","","","","","","","","","","","","","","","","","","","","","","","","","","","","","","","","","","",""
"8ALUT64Z","journalArticle","2014","Stone, Teresa E.; Levett-Jones, Tracy","A comparison of three types of stimulus material in undergraduate mental health nursing education","Nurse Education Today","","0260-6917","https://doi.org/10.1016/j.nedt.2013.07.014","https://www.sciencedirect.com/science/article/pii/S0260691713002657","Summary Aims and objectives The paper discusses an innovative educational approach that compared the use of different textual forms as stimulus materials in the teaching of an introductory mental health course. Background Practitioners in many disciplines, including nursing, appreciate the value of narratives in making sense of experiences, challenging assumptions and enhancing learning: they enable exploration of reality from different perspectives and create an emotional resonance. Narratives help nursing students to uncover embedded meanings, values and beliefs; they can include written texts, illustrated texts or picture books. Participants 180 students enrolled in an elective undergraduate nursing course. Method This project afforded students the choice of critically analysing (a) a chapter from one of two autobiographies, (b) an illustrated text, or (c) an illustration from a picture book. Each text was a narrative account from a personal or carer's perspective of the experience of mental illness. Their written submissions were then analysed by means of a qualitative descriptive approach. Results In analysis of the autobiographies students tended to paraphrase the authors' words and summarise their experiences. Those choosing the illustrated text were able to link the images and text, and provide a deeper and more insightful level of interpretation, albeit influenced by the author's personal account and expressed emotions; however, those analysing a picture book illustration demonstrated a surprising level of critical and creative thinking, and their interpretations were empathetic, insightful and thoughtful. Conclusion The use of picture books, although not a common approach in nursing education, appears to engage students, challenge them to think more deeply, and stimulate their imagination.","2014","2021-02-15 21:49:58","2021-02-15 21:49:58","","586-591","","4","34","","","","","","","","","","","","","","","","","","","","","Education; Empathy; Mental health; Nursing student; Picture books; Therapeutic engagement","","","","","","","","","","","","","","","","","","","","","","","","","","","","","","","","","","","","","","","","","","","","","","",""
"9UBNAUYR","journalArticle","2017","Toivonen, Asta Kristiina; Lindblom-Ylänne, Sari; Louhiala, Pekka; Pyörälä, Eeva","Medical students’ reflections on emotions concerning breaking bad news","Patient Education and Counseling","","0738-3991","https://doi.org/10.1016/j.pec.2017.05.036","https://www.sciencedirect.com/science/article/pii/S0738399117303427","Objectives To gain a deeper understanding of fourth year medical students’ reflections on emotions in the context of breaking bad news (BBN). Methods During the years 2010–2012, students reflected on their emotions concerning BBN in a learning assignment at the end of the communications skills course. The students were asked to write a description of how they felt about a BBN case. The reflections were analysed using qualitative content analysis. Results 351 students agreed to participate in the study. We recognized ten categories in students’ reflections namely empathy, insecurity, anxiety, sadness, ambivalence, guilt, hope, frustration, gratefulness and emotional detachment. Most students expressed empathy, but there was a clear tension between feeling empathy and retaining professional distance by emotional detachment. Conclusions Students experience strong and perplexing emotions during their studies, especially in challenging situations. A deeper understanding of students' emotions is valuable for supporting students’ professional development and coping in their work in the future. Practice implications Medical students need opportunities to reflect on emotional experiences during their education to find strategies for coping with them. Emotions should be actively discussed in studies where the issues of BBN are addressed. Teachers need education in attending emotional issues constructively.","2017","2021-02-15 21:49:58","2021-02-15 21:49:58","","1903-1909","","10","100","","","","","","","","","","","","","","","","","","","","","Emotions; Empathy; Reflection; Content analysis; Breaking bad news; Medical students; Undergraduate medical education","","","","","","","","","","","","","","","","","","","","","","","","","","","","","","","","","","","","","","","","","","","","","","",""
