"XCARTQS7","journalArticle","2018","Gardner, Janet; Emory, Jan","Changing students’ perceptions of the homeless: A community service learning experience","Nurse Education in Practice","","1471-5953","https://doi.org/10.1016/j.nepr.2018.01.001","https://www.sciencedirect.com/science/article/pii/S1471595317302743","The homeless are an underserved, local vulnerable population that can benefit from a service learning clinical practicum experience for baccalaureate prepared nursing students. Negative attitudes and disrespect among healthcare workers has been identified by the homeless as a barrier to healthcare. A service learning experience with a vulnerable population has been shown to change nursing students’ attitudes and beliefs. A large university in a southern city partnered with a community based organization that provided services to the homeless to educate senior nursing students in a service learning experience. The goal of this project was to examine attitudes and perceptions of nursing students toward the homeless population before and after participation in a service learning clinical practicum experience. This case study utilized a pre and post experience questionnaire to collect qualitative data for the purposes of the project. The findings revealed students demonstrated a decrease in fear, an increase in empathy, and a deeper understanding of the advocacy role of nurses for people experiencing homelessness. Nurse educators are challenged to engage students with vulnerable populations to change the attitudes and perceptions for improvement in the overall health of communities served worldwide. Partnerships and service learning experiences can benefit all.","2018","2021-02-15 21:50:00","2021-02-15 21:50:00","","133-136","","","29","","","","","","","","","","","","","","","","","","","","","Homeless; Nursing education; Service learning; Vulnerable populations","","","","","","","","","","","","","","","","","","","","","","","","","","","","","","","","","","","","","","","","","","","","","","",""
"48GPMTQQ","journalArticle","2019","Agopyan, H.; Griffet, J.; Poirier, T.; Bredin, J.","Modification of knee flexion during walking with use of a real-time personalized avatar","Heliyon","","2405-8440","https://doi.org/10.1016/j.heliyon.2019.e02797","https://www.sciencedirect.com/science/article/pii/S2405844019364576","Visual feedback is used in different research areas, including clinical science and neuroscience. In this study, we investigated the influence of the visualization of a real-time personalized avatar on gait parameters, focusing on knee flexion during the swing phase. We also studied the impact of the modification of avatar's knee amplitude on kinematic of the knee of healthy subjects. For this purpose, we used an immersive reality treadmill equipment and developed a 3D avatar, with instantly modifiable parameters for knee flexion and extension (acceleration or deceleration). Fourteen healthy young adults, equipped with motion capture markers, were asked to walk at a self-selected pace on the treadmill. A real-time 3D image of their lower limbs was modelized and projected on the screen ahead of them, as if in a walking motion from left to right. The subjects were instructed to continue walking. When we initiated an increase in the knee flexion of the avatar, we observed a similar increase in the subjects' knee flexion. No significant results were observed when the modification involved a decrease in knee flexion. The results and their significance are discussed using theories encompassing empathy, sympathy and sensory re-calibration. The prospect of using this type of modified avatar for stroke rehabilitation is discussed.","2019","2021-02-15 21:50:14","2021-02-15 21:50:14","","e02797","","11","5","","","","","","","","","","","","","","","","","","","","","Rehabilitation; Empathy; Neuroscience; Sympathy; Avatar; Adaptation; Biomedical engineering; Knee flexion","","","","","","","","","","","","","","","","","","","","","","","","","","","","","","","","","","","","","","","","","","","","","","",""
"74LT9YSR","journalArticle","2018","Felnhofer, Anna; Kafka, Johanna X.; Hlavacs, Helmut; Beutl, Leon; Kryspin-Exner, Ilse; Kothgassner, Oswald D.","Meeting others virtually in a day-to-day setting: Investigating social avoidance and prosocial behavior towards avatars and agents","Computers in Human Behavior","","0747-5632","https://doi.org/10.1016/j.chb.2017.11.031","https://www.sciencedirect.com/science/article/pii/S0747563217306696","Given the increasing use of virtual characters, research is challenged to gain sufficient knowledge on the effects they may have on human cognitions, emotions and behaviors. Thus, this study set out to examine social avoidance tendencies and prosocial behaviors towards human controlled (avatars) and computer controlled entities (agents). A total of N = 95 healthy young adults were randomly assigned to an avatar or agent condition. Participants were exposed to a virtual stranger asking to sit at the table (prosocial behavior) as well as a virtual waiter handing over the false drink (social avoidance). Empathy, interaction anxiety, social and physical presence as well as subjective stress levels were assessed to control for confounding influences. Empathy emerged as a significant predictor of prosocial behavior. Social avoidance, in turn, was not predicted by any of the included variables. Also, there was no effect of agency on social presence, physical presence, social interaction anxiety and stress. Yet, participants showed significantly more social avoidance and prosocial behavior towards avatars. These seemingly contradictory results may be explained by an extension of prior theories: While intuitive responses (e.g., stress) follow the Media Equation Concept (Nass & Moon, 2000), more complex processes (e.g., empathy) may modulate agency dependent responses.","2018","2021-02-15 21:50:15","2021-02-15 21:50:15","","399-406","","","80","","","","","","","","","","","","","","","","","","","","","Virtual reality; Empathy; Prosocial behavior; Avatar; Agent; Social presence","","","","","","","","","","","","","","","","","","","","","","","","","","","","","","","","","","","","","","","","","","","","","","",""
"HCY4THM6","journalArticle","2019","MacDorman, Karl F.","In the uncanny valley, transportation predicts narrative enjoyment more than empathy, but only for the tragic hero","Computers in Human Behavior","","0747-5632","https://doi.org/10.1016/j.chb.2019.01.011","https://www.sciencedirect.com/science/article/pii/S0747563219300202","The uncanny valley is a term used to describe the phenomenon that human simulations that are nearly but not quite realistic often give viewers an uneasy, eerie feeling. Given the prevalence of computer-animated human characters and a narrative framework in videogames, serious games, and health-related scenarios, it is important to examine how the uncanny valley influences narrative empathy and enjoyment. In a 2 × 2 × 2 between-groups posttest-only experiment, 738 participants took the role of a patient in a virtual consultation with a doctor; the consultation varied in the doctor's character (hero or villain), its subplot ending (happy or tragic), and its depiction (computer animated or real). The participants' posttest results showed greater emotional empathy and enjoyment in the hero condition and no significant difference in emotional empathy for the computer animation but greater narrative enjoyment and persuasion. Just endings (hero rewarded, villain punished) elicited much greater pleasure than unjust endings. In comparing computer animation with recorded video, emotional empathy was a significantly stronger predictor of narrative enjoyment than transportation only for the real hero with a tragic ending. The enjoyment and persuasiveness of the computer-animated doctor–patient consultation bodes well for the use of animation in interactive visual narratives.","2019","2021-02-15 21:50:15","2021-02-15 21:50:15","","140-153","","","94","","","","","","","","","","","","","","","","","","","","","Uncanny valley; Avatars; Anthropomorphism; Computer animation; Emotional empathy; Interactive narratives","","","","","","","","","","","","","","","","","","","","","","","","","","","","","","","","","","","","","","","","","","","","","","",""
"3H542CFK","journalArticle","2020","Bonnardel, Nathalie; Pichot, Nicolas","Enhancing collaborative creativity with virtual dynamic personas","Applied Ergonomics","","0003-6870","https://doi.org/10.1016/j.apergo.2019.102949","https://www.sciencedirect.com/science/article/pii/S0003687018305623","In many sectors, designers have to develop products that are creative, and thus both new and adapted to the context. They can use a variety of methods to favor their creative design activities, including a new one that we have developed, featuring dynamic personas. This method allows participants to interact in real time in a virtual space with an avatar that represents an archetypal future user and provides them with information about this future user throughout the interactions. In the present experimental study, we compared this method with the classic (or static) persona method, by asking 102 participants to perform a creative design task. Results revealed statistical differences between the use of the static and dynamic persona methods, and highlighted the advantages of the dynamic method over the static one. We discuss the prospects for using this method in an ecological setting and identify the aspects to be improved.","2020","2021-02-15 21:50:15","2021-02-15 21:50:15","","102949","","","82","","","","","","","","","","","","","","","","","","","","","Design; Creativity; Personas","","","","","","","","","","","","","","","","","","","","","","","","","","","","","","","","","","","","","","","","","","","","","","",""
"MFKEWSIH","journalArticle","2017","Stein, Jan-Philipp; Ohler, Peter","Venturing into the uncanny valley of mind—The influence of mind attribution on the acceptance of human-like characters in a virtual reality setting","Cognition","","0010-0277","https://doi.org/10.1016/j.cognition.2016.12.010","https://www.sciencedirect.com/science/article/pii/S0010027716303055","For more than 40years, the uncanny valley model has captivated researchers from various fields of expertise. Still, explanations as to why slightly imperfect human-like characters can evoke feelings of eeriness remain the subject of controversy. Many experiments exploring the phenomenon have emphasized specific visual factors in connection to evolutionary psychological theories or an underlying categorization conflict. More recently, studies have also shifted away focus from the appearance of human-like entities, instead exploring their mental capabilities as basis for observers' discomfort. In order to advance this perspective, we introduced 92 participants to a virtual reality (VR) chat program and presented them with two digital characters engaged in an emotional and empathic dialogue. Using the same pre-recorded 3D scene, we manipulated the perceived control type of the depicted characters (human-controlled avatars vs. computer-controlled agents), as well as their alleged level of autonomy (scripted vs. self-directed actions). Statistical analyses revealed that participants experienced significantly stronger eeriness if they perceived the empathic characters to be autonomous artificial intelligences. As human likeness and attractiveness ratings did not result in significant group differences, we present our results as evidence for an “uncanny valley of mind“ that relies on the attribution of emotions and social cognition to non-human entities. A possible relationship to the philosophy of anthropocentrism and its “threat to human distinctiveness” concept is discussed.","2017","2021-02-15 21:50:15","2021-02-15 21:50:15","","43-50","","","160","","","","","","","","","","","","","","","","","","","","","Virtual reality; Artificial intelligence; Anthropocentrism; Social cognition; Theory of mind; Uncanny valley","","","","","","","","","","","","","","","","","","","","","","","","","","","","","","","","","","","","","","","","","","","","","","",""
"BLEDN2ML","journalArticle","2017","Leménager, T.; Dieter, J.; Hill, H.; Mann, K.; Kiefer, F.","Internet addiction and the virtual self-image","European Psychiatry","","0924-9338","https://doi.org/10.1016/j.eurpsy.2017.01.136","https://www.sciencedirect.com/science/article/pii/S0924933817301414","Background Internet gaming disorder appears to be associated with self-concept deficits and increased identification with one's avatar. For increased social network use, the few existing studies suggest striatal-related positive social feedback as an underlying factor. Furthermore, few study findings indicate that internet addicts generally have problems in emotional inhibitory control processing. Methods Pathological and addicted internet gamers as well as social network users were compared with healthy controls regarding psychometric and neurobiological measures of self-concept-related characteristics, avatar identification and emotional inhibitory control processing. Results and conclusion Psychometric results indicated that both subgroups showed higher self-concept deficits compared to healthy controls. Neurobiologically, different brain activation patterns were observed in the subgroups during self-knowledge retrieval and inhibition of emotional stimuli. Furthermore, addicted internet gamers showed a higher identification with the own avatar, mirrored in an increased left angular gyrus activation, a region functionally associated with identification processing and feelings of empathy. These findings provide a starting point for the deduction of specific psychotherapeutic treatment approaches for addicted internet gamers and social network users.","2017","2021-02-15 21:50:15","2021-02-15 21:50:15","","S26","","","41","","","","","","","","","","","","","","","","","","<p>Abstract of the 25th European Congress of Psychiatry</p>","","","","","","","","","","","","","","","","","","","","","","","","","","","","","","","","","","","","","","","","","","","","","","","","","",""
"9GB9DIUF","journalArticle","2015","Lemenager, T.","Psychological and Neurobiological Mechanisms of Pathological Internet Use","European Psychiatry","","0924-9338","https://doi.org/10.1016/S0924-9338(15)30102-4","https://www.sciencedirect.com/science/article/pii/S0924933815301024","Background Studies on internet gaming disorders indicate that especially online role-playing games have a high addictive potential in particular in male adolescents. These games enable the parallel gaming of multiple users in online virtual worlds with or against each other via their graphical agent (avatar). Recent findings suggest online role-playing addicts to have a deficient self-concept. The latter's potential compensation by means of a higher identification with the own avatar might be an etiological factor in the development of an online role-playing game addiction. On a neurobiological level, especially the left Angular Gyrus (AG) seems to be associated with identification and empathy processes. An according fMRI-based study on long-term gamers of online role-playing games indicated increased brain activations in the left AG during the rating of personality traits referring to the avatar relative to self-referencing and the referencing of close others (Ganesh et al., 2011). However, the extent to which these results represent specific neurobiological mechanisms that are associated with self-concept deficits or a stronger identification with the own avatar in the development of online role-playing game addiction remains unknown to date. Methods N=16 addicted and n=17 regular gamers of online role-playing games (mean age=28 and 26 years, respectively) underwent functional Magnetic Resonance Imaging (fMRI) while 1) completing a Giessen-Test (GT)-derived paradigm assessing participants’ concepts of self, ideal and avatar and 2) while viewing and evaluating images of the own person, the own avatar as well as unknown persons. Additionally, a questionnaire referring to the own body image and a Visual Analogue Scale (VAS) for the evaluation of the own as well as avatar's attractiveness, sympathy and gender identity were applied. Results Addicts of online role-playing games rated their body image, gender identity and social response (i.e. social popularity) significantly lower. Neurobiologically, they showed increased left AG activations during the reflection about their avatar (relative to their ideal and/or their self) compared to non-addicted gamers. Furthermore, within-group differences revealed left AG response during the perception of images showing their avatar (relative to images of themselves). In addition, addicted gamers had hypoactivations in the bilateral AG during the perception of images of their own person compared to the perception of unknown persons. The left-lateral AG hypoactivation positively correlated with the degree of the gender identity. Discussion In line with previous findings, our results indicate self-concept deficits in online role-playing game addicts and a stronger identification with the own avatar, which might neurobiologically be reflected in AG activations. The results could point towards problems in the formation of an own identity as a cause for online role-playing game addiction development. Longitudinal studies may shed light on these potentially causal relations.","2015","2021-02-15 21:50:15","2021-02-15 21:50:15","","123","","","30","","","","","","","","","","","","","","","","","","<p>Abstracts of the 23rd European Congress of Psychiatry</p>","","","","","","","","","","","","","","","","","","","","","","","","","","","","","","","","","","","","","","","","","","","","","","","","","",""
"N3XDLEVX","journalArticle","2016","Tordo, Frédéric; Binkley, Caroline","L’auto-empathie, ou le devenir de l’autrui-en-soi : définition et clinique du virtuel","L'Évolution Psychiatrique","","0014-3855","https://doi.org/10.1016/j.evopsy.2014.02.002","https://www.sciencedirect.com/science/article/pii/S001438551400036X","Résumé Objectifs Les auteurs se proposent d’explorer un phénomène psychique, l’« auto-empathie », tel qu’il est mis en œuvre dans le contexte des espaces numériques et singulièrement dans la situation du joueur qui incarne un avatar (une figure de pixel) dans un jeu vidéo. Méthode Dans la perspective d’une ouverture théorique à la fois phénoménologique et psychanalytique, l’auto-empathie est le processus au cours duquel, en prenant la position de l’« autrui-en-soi », nous nous représentons notre monde subjectif – soit l’ensemble de nos états de subjectivité (actions, émotions, pensées) –, par relation empathique avec nous-mêmes. Cette relation d’auto-empathie correspond à une opération de distanciation, et d’appropriation symbolique, au cours de laquelle nous nous dédoublons, en mettant en œuvre notre faculté innée d’être à la fois sujet et objet pour nous-mêmes. Résultats La médiatisation de l’auto-empathie dans les mondes numériques permet de nous mettre à la place d’une figure qui nous représente – notre avatar –, de sorte que notre empathie est tournée vers nous-mêmes indirectement. Ce second temps d’empathie pour une figure virtuelle de soi, nommé « auto-empathie médiatisée » ou « auto-empathie virtuelle », favoriserait dans un troisième temps le développement d’une empathie pour soi. Enfin, le développement d’une empathie pour autrui serait soutenu dans un quatrième temps, par l’attention que les joueurs se portent les uns aux autres dans les jeux en réseau. Discussion Ces quatre hypothèses, illustrées par des cas cliniques, ouvrent une interrogation portant sur le cadre en psychanalyse. À l’adolescence, le travail de virtualisation, qui consiste en l’anticipation créatrice de ses possibilités subjectives, apparaît régulièrement contrarié. La duplicité psychique n’est plus à même d’opérer une distance symbolisante entre le soi réel et le soi virtuel, entre le soi subjectif et le soi subjectivant. L’autrui-en-soi est inefficace à proposer à l’adolescence un dialogue empathique avec soi-même. En conséquence, l’autoreprésentation flirte avec l’effondrement, en particulier dans les états de cassures subjectives. Or, les espaces numériques pourraient bien être pour l’adolescent des supports indirects d’appropriation d’expériences subjectives. Conclusion Nos réflexions ont conduit à penser l’auto-empathie comme la réalisation de l’autrui-en-soi qui permet de nous représenter notre propre monde subjectif. L’auto-empathie médiatisée par un avatar peut donc être décrite comme une représentation par empathie de notre part subjective contenue par ce personnage. Dès lors, l’espace du jeu vidéo se présente comme un espace de subjectivation. Objectives The authors propose to explore a psychic phenomenon, the “auto-empathy”, as implemented in the context of digital spaces and particularly in the situation of the player who embodies an avatar (a pixel figure) in a video game. Method From the perspective of a theoretical opening both phenomenological and psychoanalytic, auto-empathy is the process in which, taking the position of the “other-in-oneself”, we represent our subjective world – or the all states of our subjectivity (actions, emotions, thoughts) – by an empathic relationship with ourselves. The auto-empathy relationship is a process of distancing, and symbolic appropriation, in which we are divided into halves, implementing our innate ability to be both subject and object for ourselves. Results The mediatization of auto-empathy in digital worlds can put ourselves instead of a figure that represents us – our avatar – so that our empathy is turned towards ourselves indirectly. This second time of empathy for a virtual figure of the self, called “mediatized auto-empathy” or “virtual auto-empathy”, would contribute thirdly to the development of empathy for oneself. Finally, the development of empathy for others would be supported in a fourth time, by the attention the players are paying to each other in network games. Discussion These four hypotheses, illustrated by clinical cases, open an interrogation concerning the frame of the psychoanalytical work. In the adolescent, the work of virtualisation, which consists in the creative anticipation of its subjective possibilities, seems regularly impeded. The mental duplicity is no longer in a position to operate a symbolizing distance between the real self and the virtual self, between the subjective self and the subjectivising self. The other-in-oneself is ineffective in proposing to the adolescent an empathic dialogue with oneself. Consequently, the autorepresentation flirts with the seizure, in particular in the subjective states of breaks. Nevertheless, the digital spaces could be indirect media of appropriation of subjective experiences for the teenager. Conclusion Our reflections led us to think of auto-empathy as the realization of the other-in-oneself which allows us to represent our own subjective world. The auto-empathy mediatized by an avatar can thus be described as a representation by empathy of our subjective part that contains this character. From then on, the space of the video game appears as a space of subjectivation.","2016","2021-02-15 21:50:15","2021-02-15 21:50:15","","293-308","","2","81","","","","","","","","","","","","","","","","","","","","","Empathy; Phenomenology; Auto-empathy; MMORPG; Video games; Others-in-oneself; Psychoanalysis; Reflexiveness; Subjectivation; Theoretical study; Auto-empathie; Autrui-en-soi; Empathie; Étude théorique; Jeu vidéo; Phénoménologie; Psychanalyse; Réflexivité","","","","","","","","","","","","","","","","","","","","","","","","","","","","","","","","","","","","","","","","","","","","","","",""
