"Key","Item Type","Publication Year","Author","Title","Publication Title","ISBN","ISSN","DOI","Url","Abstract Note","Date","Date Added","Date Modified","Access Date","Pages","Num Pages","Issue","Volume","Number Of Volumes","Journal Abbreviation","Short Title","Series","Series Number","Series Text","Series Title","Publisher","Place","Language","Rights","Type","Archive","Archive Location","Library Catalog","Call Number","Extra","Notes","File Attachments","Link Attachments","Manual Tags","Automatic Tags","Editor","Series Editor","Translator","Contributor","Attorney Agent","Book Author","Cast Member","Commenter","Composer","Cosponsor","Counsel","Interviewer","Producer","Recipient","Reviewed Author","Scriptwriter","Words By","Guest","Number","Edition","Running Time","Scale","Medium","Artwork Size","Filing Date","Application Number","Assignee","Issuing Authority","Country","Meeting Name","Conference Name","Court","References","Reporter","Legal Status","Priority Numbers","Programming Language","Version","System","Code","Code Number","Section","Session","Committee","History","Legislative Body"
"LF77RFTT","conferencePaper","2018","James, Jesin; Watson, Catherine Inez; MacDonald, Bruce","Artificial Empathy in Social Robots: An analysis of Emotions in Speech","2018 27th IEEE International Symposium on Robot and Human Interactive Communication (RO-MAN)","","","10.1109/ROMAN.2018.8525652","","Artificial speech developed using speech synthesizers has been used as the voice for robots in Human Robot Interaction (HRI). As humans anthropomorphize robots, an empathetically interacting robot is expected to increase the level of acceptance of social robots. Here, a human perception experiment evaluates whether human subjects perceive empathy in robot speech. For this experiment, empathy is expressed only by adding appropriate emotions to the words in speech. Also, humans' preferences for a robot interacting with empathetic speech versus a standard robotic voice are also assessed. The results show that humans are able to perceive empathy and emotions in robot speech, and prefer it over the standard robotic voice. It is important for the emotions in empathetic speech to be consistent with the language content of what is being said, and with the human users' emotional state. Analyzing emotions in empathetic speech using valence-arousal model has revealed the importance of secondary emotions in developing empathetically speaking social robots.","2018-08","2021-05-19 12:41:47","2021-05-19 12:41:47","","632-637","","","","","","","","","","","","","","","","","","","","ISSN: 1944-9437","","","","Task analysis; Medical services; Human-robot interaction; Robot sensing systems; Anthropomorphism; Standards","","","","","","","","","","","","","","","","","","","","","","","","","","","","","","","","","","","","","","","","","","","","","","",""
"7IUU84GN","conferencePaper","2019","Peterson, Jordan; Cohen, Chase; Harrison, Paige; Novak, Jonathan; Tossell, Chad; Phillips, Elizabeth","Ideal Warrior and Robot Relations: Stress and Empathy's Role in Human-Robot Teaming","2019 Systems and Information Engineering Design Symposium (SIEDS)","","","10.1109/SIEDS.2019.8735613","","The battlefield of the future will look very different than the battlefields of the past. Automated technologies are finding themselves more and more integrated into every aspect of the fight. As technology continues to advance, the United States Military must consider what a human-machine team will look like and how an optimal relationship between the two assets can be formed, especially under the stressful conditions that often characterize military contexts. For a human-machine team in a military context to work at maximum efficiency, an ideal level of empathy towards an automated teammate must be obtained. The goal of this study is to determine the effect stress can have on an individual's empathetic reaction toward a Pepper robot. Twenty-eight participants interacted with a Pepper robot either under stress or not. Empathy toward the robot was measured through subjective assessments as well as by participant decisions to continue interacting with Pepper even though doing so would harm the robot. Although not conclusive, the results suggest an interaction between participant gender and stress on empathy toward the Pepper robot. Women showed more empathy toward Pepper under higher levels of stress than lower levels of stress. However, the opposite was true for men. Men showed less empathy toward Pepper under higher levels of stress. The results of this study could help to inform military training and robot design.","2019-04","2021-05-19 12:41:47","2021-05-19 12:41:47","","1-6","","","","","","","","","","","","","","","","","","","","","","","","Stress; Task analysis; Human-robot interaction; Robots; Atmospheric measurements; Particle measurements; Battery charge measurement; Human-machine teaming; Military aircraft","","","","","","","","","","","","","","","","","","","","","","","","","","","","","","","","","","","","","","","","","","","","","","",""
"N4NB53SJ","conferencePaper","2020","Simons, Ama; Doyle, Thomas; Musson, David; Reilly, James","Impact of Physiological Sensor Variance on Machine Learning Algorithms","2020 IEEE International Conference on Systems, Man, and Cybernetics (SMC)","","","10.1109/SMC42975.2020.9282912","","Machine learning based acute stress detection systems use physiological sensor data to objectively predict acute stress. However, machine learning algorithms developed for stress detection do not consider how machine learning algorithm performance may be affected based on a change(s) in the deployment environment. In this study, the deployment environment changes that are investigated are sensor type and sensor placement. Electrodermal activity (EDA) and skin temperature (TEMP) data from two different sensors, the RespiBAN Professional (RespiBAN) and the Empatica E4 are used to train three different machine learning models. The RespiBAN records the EDA data from the rectus abdominis and records the skin TEMP data from the sternum. The Empatica E4 sensor records both EDA and skin TEMP data from the wrist. Three different support vector machine (SVM) models were trained to classify no-stress versus stress states using EDA and skin TEMP data. The first model was trained using data from the RespiBAN wearable sensor (SVM-R), the second model was trained using data from the Empatica E4 sensor (SVM-E) and third model was trained using data from both sensors (SVM-RE). The accuracy of SVM-R on a test set recorded by the RespiBAN sensor was 100%. The accuracy of SVM-E on a test set recorded by the Empatica E4 sensor was 99%. The accuracy of SVM-RE on a test set recorded by both the RespiBAN and Empatica E4 sensor was 82%. The accuracy of the SVM-R on a test set recorded by the Empatica E4 was 64%. These results suggest that research and development cannot be hardware or placement agnostic with wearable sensing data. Sensor type and placement must be taken into consideration when reporting performance metrics of physiological based stress detection machine learning algorithms.","2020-10","2021-05-19 12:41:47","2021-05-19 12:41:47","","241-247","","","","","","","","","","","","","","","","","","","","ISSN: 2577-1655","","","","Stress; Machine learning; Data models; Machine learning algorithms; Skin; Physiology; support vector machine; Support vector machines; stress detection; wearable physiological sensors","","","","","","","","","","","","","","","","","","","","","","","","","","","","","","","","","","","","","","","","","","","","","","",""
"J8VDFW2Y","conferencePaper","2015","Darling, Kate; Nandy, Palash; Breazeal, Cynthia","Empathic concern and the effect of stories in human-robot interaction","2015 24th IEEE International Symposium on Robot and Human Interactive Communication (RO-MAN)","","","10.1109/ROMAN.2015.7333675","","People have been shown to project lifelike attributes onto robots and to display behavior indicative of empathy in human-robot interaction. Our work explores the role of empathy by examining how humans respond to a simple robotic object when asked to strike it. We measure the effects of lifelike movement and stories on people's hesitation to strike the robot, and we evaluate the relationship between hesitation and people's trait empathy. Our results show that people with a certain type of high trait empathy (empathic concern) hesitate to strike the robots. We also find that high empathic concern and hesitation are more strongly related for robots with stories. This suggests that high trait empathy increases people's hesitation to strike a robot, and that stories may positively influence their empathic responses.","2015-08","2021-05-19 12:41:47","2021-05-19 12:41:47","","770-775","","","","","","","","","","","","","","","","","","","","","","","","Media; Human-robot interaction; Robots; Atmospheric measurements; Indexes; Particle measurements; Videos","","","","","","","","","","","","","","","","","","","","","","","","","","","","","","","","","","","","","","","","","","","","","","",""
"FNNDRVXI","conferencePaper","2017","Burns, Henriette D.; Lesseig, Kristin","Empathy in middle school engineering design process","2017 IEEE Frontiers in Education Conference (FIE)","","","10.1109/FIE.2017.8190669","","This work-in-progress studies empathy in middle-school engineering design pedagogy. A model of empathy in engineering as a core skill, as a practice orientation and a professional way of being that can be taught in university programs has been proposed [1]. Does an emotional intelligence model of empathy need to be taught earlier than at the university level? The engineering design process has been included in the science standards for k-12 schools since 2013[2]. One of the purposes of this inclusion is the ability to reach a diverse population of students by applying real world problems in their curriculum. The design process typically includes the steps of defining the engineering problem, developing solutions and optimizing the design. Although the word “empathy” is not used, these problems are defined from an empathetic perspective as “situations people want to change” of “social and global significance.” However, the standards do not discuss how to define a problem or how to teach empathy. In the winter of 2016 a study was conducted to evaluate the influence of empathy-based lessons on girls' interest in science, technology, engineering and mathematics (STEM). Some information is known about empathy in lessons. Girls may be more interested if lessons are altered to include an element of caring [3]. Other studies indicate children's empathy increases with type of media provided in lesson (computer versus robot) [4]. The study in this article was a qualitative case study of 50 children, grades 6, 7, and 8, boys and girls in an after-school 4-H Science Club. The lessons were conducted once per week. The lessons were previously conducted in an all-girls after-school STEM program with similar available inexpensive materials. Both schools had similar demographics. The students and coordinators(instructors) were observed, pre- and post-surveys were conducted, and interviews of both students and coordinators were audio and/or video-taped. Although responses varied by lesson, initial results indicate many students and coordinators did not understand the meaning of empathy situated in engineering design.","2017-10","2021-05-19 12:41:47","2021-05-19 12:41:47","","1-4","","","","","","","","","","","","","","","","","","","","","","","","empathy; design process; 5G mobile communication; after-school science club; Computer bugs; engineering; middle school","","","","","","","","","","","","","","","","","","","","","","","","","","","","","","","","","","","","","","","","","","","","","","",""
"VYKSHQE5","conferencePaper","2015","Rasool, Zeeshan; Masuyama, Naoki; Islam, Md. Nazrul; Loo, Chu Kiong","Empathic Interaction Using the Computational Emotion Model","2015 IEEE Symposium Series on Computational Intelligence","","","10.1109/SSCI.2015.26","","This paper describes the empathy oriented human-robot interaction model. It is projected to design the model capable of different empathic responses (parallel and reactive) during the course of interaction with the user, depending upon the personality and mood factors of the robot. The proposed model encompasses three main stages i.e., Perception, empathic appraisal and empathic expression. Perception refers to capturing user's emotion state via facial expression recognition. Empathic appraisal is based on the computational emotional model for generating its internal emotions, mood state and empathic responses. The internal emotions are defined using psychological studies and generated on 2D (pleasure-arousal) scaling model, whereas, fuzzy logic is used to calculate the intensity of the each emotion. A virtual facial expression simulator is applied for expression of resultant empathic emotions. Preliminary experimental results show that the proposed model is capable of exhibiting different empathic responses with respect to the personality and mood factors.","2015-12","2021-05-19 12:41:47","2021-05-19 12:41:47","","109-116","","","","","","","","","","","","","","","","","","","","","","","","Computational modeling; Robots; Face; Face recognition; Shape; Mood; Clustering algorithms","","","","","","","","","","","","","","","","","","","","","","","","","","","","","","","","","","","","","","","","","","","","","","",""
"M6R5YVFG","conferencePaper","2018","Mollahosseini, Ali; Abdollahi, Hojjat; Mahoor, Mohammad H","Studying Effects of Incorporating Automated Affect Perception with Spoken Dialog in Social Robots","2018 27th IEEE International Symposium on Robot and Human Interactive Communication (RO-MAN)","","","10.1109/ROMAN.2018.8525777","","Social robots are becoming an integrated part of our daily lives with the goal of understanding humans' social intentions and feelings, a capability which is often referred to as empathy. Despite significant progress towards the development of empathic social agents, current social robots have yet to reach the full emotional and social capabilities. This paper presents our recent effort on incorporating an automated Facial Expression Recognition (FER) system based on deep neural networks into the spoken dialog of a social robot (Ryan) to extend and enrich its capabilities beyond spoken dialog and integrate the user's affect state into the robot's responses. In order to evaluate whether this incorporation can improve social capabilities of Ryan, we conducted a series of Human-Robot-Interaction (HRI) experiments. In these experiments the subjects watched some videos and Ryan engaged them in a conversation driven by user's facial expressions perceived by the robot. We measured the accuracy of the automated FER system on the robot when interacting with different human subjects as well as three social/interactive aspects, namely task engagement, empathy, and likability of the robot. The results of our HRI study indicate that the subjects rated empathy and likability of the affect-aware Ryan significantly higher than non-empathic (the control condition) Ryan. Interestingly, we found that the accuracy of the FER system is not a limiting factor, as subjects rated the affect-aware agent equipped with a low accuracy FER system as empathic and likable as when facial expression was recognized by a human observer.","2018-08","2021-05-19 12:41:47","2021-05-19 12:41:47","","783-789","","","","","","","","","","","","","","","","","","","","ISSN: 1944-9437","","","","Task analysis; Robots; Videos; Face recognition; Mirrors; Observers; Speech recognition","","","","","","","","","","","","","","","","","","","","","","","","","","","","","","","","","","","","","","","","","","","","","","",""
"GUDECYJY","conferencePaper","2015","Seo, Stela H.; Geiskkovitch, Denise; Nakane, Masayuki; King, Corey; Young, James E.","Poor Thing! Would You Feel Sorry for a Simulated Robot? A comparison of empathy toward a physical and a simulated robot","2015 10th ACM/IEEE International Conference on Human-Robot Interaction (HRI)","","","","","In designing and evaluating human-robot interactions and interfaces, researchers often use a simulated robot due to the high cost of robots and time required to program them. However, it is important to consider how interaction with a simulated robot differs from a real robot; that is, do simulated robots provide authentic interaction? We contribute to a growing body of work that explores this question and maps out simulated-versus-real differences, by explicitly investigating empathy: how people empathize with a physical or simulated robot when something bad happens to it. Our results suggest that people may empathize more with a physical robot than a simulated one, a finding that has important implications on the generalizability and applicability of simulated HRI work. Empathy is particularly relevant to social HRI and is integral to, for example, companion and care robots. Our contribution additionally includes an original and reproducible HRI experimental design to induce empathy toward robots in laboratory settings, and an experimentally validated empathy-measuring instrument from psychology for use with HRI. Categories and Subject Descriptors H.5.2 [User Interfaces]: evaluation/methodology General Terms Experimentation and Human Factors.","2015-03","2021-05-19 12:41:47","2021-05-19 12:41:47","","125-132","","","","","","","","","","","","","","","","","","","","ISSN: 2167-2121","","","","Computational modeling; Programming; Psychology; empathy; Human-robot interaction; Robots; Videos; Instruments; robot embodiment; simulated interaction","","","","","","","","","","","","","","","","","","","","","","","","","","","","","","","","","","","","","","","","","","","","","","",""
"WII43CUQ","journalArticle","2015","Pablos, Samuel Marcos; García-Bermejo, Jaime Gómez; ZalamaCasanova, Eduardo; López, Joaquín","Dynamic Facial Emotion Recognition Oriented to HCI Applications","Interacting with Computers","","1873-7951","10.1093/iwc/iwt057","","As part of a multimodal animated avatar previously presented in Marcos-Pablos et al. ((2010) A realistic, virtual head for human-computer interaction. Interact. Comput., 22, 176–192, ISSN 0953-5438), in this paper we describe a method for dynamic recognition of displayed facial emotions on low-resolution streaming images. First, we address the detection of action units (AUs) of the facial action coding system using active shape models and Gabor filters. Normalized outputs of the AU recognition step are then used as inputs for a neural network that consists of an habituation network plus a competitive network. Both the competitive and the habituation layer use differential equations, thus taking into account the dynamic information of facial expressions through time. Experimental results carried out on live video sequences and on the Cohn-Kanade face database show that the proposed method provides high recognition hit rates. To assess the suitability of the developed emotional recognition system for human–computer interaction applications, it has been successfully integrated in the architecture of an avatar and we have conducted a preliminary experiment on empathy. The experiment showed promising results, as the avatar that made use of the emotional recognition system obtained a clear increase in the positivity of the rating when compared with the same avatar with no emotional response.","2015-03","2021-05-19 12:41:47","2021-05-19 12:41:47","","99-119","","2","27","","","","","","","","","","","","","","","","","","","","","agent-based interaction; computer vision; empirical studies in ubiquitous and mobile computing; gestural input; graphical user interfaces; intelligent avatars","","","","","","","","","","","","","","","","","","","","","","","","","","","","","","","","","","","","","","","","","","","","","","",""
"UBPMUAWD","conferencePaper","2018","Febtriko, Anip; Rahayuningsih, Tri; Septiani, Dinda; Trisnawati, Liza; Arisandi, Diki; Sukri","Effectiveness Of Android-Based Mobile Robots For Children Asperger Syndrome","2018 International Conference on Applied Information Technology and Innovation (ICAITI)","","","10.1109/ICAITI.2018.8686759","","Autistic disorder is a disorder or developmental disorder in social interaction and communication and is characterized by limited activity and interest. One type of autism is Asperger Syndrome is a personal qualitative weakness in communicating and social interaction. Just like any other autistic child with Asperger's Syndrome, it is very difficult to understand emotions. Limitations in expressing and understanding emotions cause children with Asperger's Syndrome to retreat socially like aloof, indifferent, less interested in others, lack empathy, think in one direction, and think hard. Therefore it is necessary to apply play therapy for children with Asperger Syndrome disorder by using Android Mobile-based robot as a robot control tool. Wheel-shaped robot or wheeled robot with work area in the form of obstacles and obstacles with the aim that there is a challenge to run the robot. Research using Pre experimental design. The population in sampling is 15 children. Children with Asperger's Syndrome take the 6 -12 year age example at special school for Pekanbaru children. Data collection to assess the outcome of play therapy using Mobile robot, the data collected were analyzed by descriptive analysis and Rank Wilcoxon test. The main purpose of this study is the influence or effectiveness of the use of android-based mobile robots as a control tool against Asperger's Syndrome disorder in children in independent schools Pekanbaru to communicate and interact socially.","2018-09","2021-05-19 12:41:47","2021-05-19 12:41:47","","208-212","","","","","","","","","","","","","","","","","","","","","","","","Mobile Robot; Android; Asperger syndrome; Rank Wilcoxon","","","","","","","","","","","","","","","","","","","","","","","","","","","","","","","","","","","","","","","","","","","","","","",""
"NL59LW89","conferencePaper","2019","Mallol-Ragolta, Adria; Schmitt, Maximilian; Baird, Alice; Cummins, Nicholas; Schuller, Björn","Performance Analysis of Unimodal and Multimodal Models in Valence-Based Empathy Recognition","2019 14th IEEE International Conference on Automatic Face Gesture Recognition (FG 2019)","","","10.1109/FG.2019.8756517","","The human ability to empathise is a core aspect of successful interpersonal relationships. In this regard, human-robot interaction can be improved through the automatic perception of empathy, among other human attributes, allowing robots to affectively adapt their actions to interactants' feelings in any given situation. This paper presents our contribution to the generalised track of the One-Minute Gradual (OMG) Empathy Prediction Challenge by describing our approach to predict a listener's valence during semi-scripted actor-listener interactions. We extract visual and acoustic features from the interactions and feed them into a bidirectional long short-term memory network to capture the time-dependencies of the valence-based empathy during the interactions. Generalised and personalised unimodal and multimodal valence-based empathy models are then trained to assess the impact of each modality on the system performance. Furthermore, we analyse if intra-subject dependencies on empathy perception affect the system performance. We assess the models by computing the concordance correlation coefficient (CCC) between the predicted and self-annotated valence scores. The results support the suitability of employing multimodal data to recognise participants' valence-based empathy during the interactions, and highlight the subject-dependency of empathy. In particular, we obtained our best result with a personalised multimodal model, which achieved a CCC of 0.11 on the test set.","2019-05","2021-05-19 12:41:47","2021-05-19 12:41:47","","1-5","","","","","","","","","","","","","","","","","","","","","","","","","","","","","","","","","","","","","","","","","","","","","","","","","","","","","","","","","","","","","","","","","","","","","","",""
