"P6TMBYLT","conferencePaper","2019","Chiu, K. C.","Use Text Mining to Abstract Affective Words in the Dream Log to Assist Dream Consultation","2019 IEEE International Conference on Industrial Engineering and Engineering Management (IEEM)","","","10.1109/IEEM44572.2019.8978876","","This study analyzes affective expression in dream log by text mining, guide participants focusing on the affective words in their dream log to release their emotions. This study provided a new method for exploring the correlation between dream and stress in psychology research area, and improved the application of knowledge management by text mining for dream log. The results show that teacher or counselor can improve their consultation by feeling empathy with the affective words in the dream log those emotions be ignored in previously consultation but picked from dream log by artificial intelligence.","2019-12","2021-05-19 12:41:49","2021-05-19 12:41:49","","1516-1520","","","","","","","","","","","","","","","","","","","","ISSN: 2157-362X","","","","Artificial Intelligence; Dream Consultation; Knowledge Management; Text Mining; Semantic Analytics","","","","","","","","","","","","","","","","","","","","","","","","","","","","","","","","","","","","","","","","","","","","","","",""
"63L3EL3K","conferencePaper","2020","Wang, Zicheng","Future Challenges in the Next Generation of Voice User Interface","2020 International Conference on Computing and Data Science (CDS)","","","10.1109/CDS49703.2020.00045","","With the development of artificial intelligence technology, artificial interactions come up for providing powerful assistance to our lives. Among them, voice user interface (VUI) plays important roles in assisting the disabled and complex interaction scenarios. This paper mainly introduces the key elements and core technics in VUI. Also, future challenges will be discussed from the perspective of empathy, ethics, and accessibility. This paper serves as a summary for future study in VUI.","2020-08","2021-05-19 12:41:49","2021-05-19 12:41:49","","191-193","","","","","","","","","","","","","","","","","","","","","","","","artificial intelligence; accessibility; Data science; user interface; voice user interface","","","","","","","","","","","","","","","","","","","","","","","","","","","","","","","","","","","","","","","","","","","","","","",""
"X7QJ24SG","conferencePaper","2019","Barbieri, Francesco; Guizzo, Eric; Lucchesi, Federico; Maffei, Giovanni; del Prado Martín, Fermín Moscoso; Weyde, Tillman","Towards a Multimodal Time-Based Empathy Prediction System","2019 14th IEEE International Conference on Automatic Face Gesture Recognition (FG 2019)","","","10.1109/FG.2019.8756532","","We describe our system for empathic emotion recognition. It is based on deep learning on multiple modalities in a late fusion architecture. We describe the modules of our system and discuss the evaluation results. Our code is also available for the research community.","2019-05","2021-05-19 12:41:49","2021-05-19 12:41:49","","1-5","","","","","","","","","","","","","","","","","","","","","","","","","","","","","","","","","","","","","","","","","","","","","","","","","","","","","","","","","","","","","","","","","","","","","","",""
"VMX6TPZI","conferencePaper","2019","Costantini, Stefania; De Gasperis, Giovanni; Migliarini, Patrizio","Multi-agent System Engineering for Emphatic Human-Robot Interaction","2019 IEEE Second International Conference on Artificial Intelligence and Knowledge Engineering (AIKE)","","","10.1109/AIKE.2019.00015","","Human-robot interactions have to take into account the natural multi-modal bidirectional communication model that is common among humans. The model does not rely just on speech and verbal exchange, but it shall include emotional exchange through different channels: face muscles, body posture, voice modulation, skin responses, odors, etc. While some aspects are feasible yet far from being adopted by daily robotic interaction with humans, the other ones can exploit current level of technology so as to be included in common, although complex, human-robot communication use cases. In order to cope in synergic but efficient and modular way with the various emphatic communication aspects, we propose to employ intelligent agents and multi-agent system. Such multi-agent system comprises a controller sub-system aboard the robot, which is coordinated by logical agents that can incorporate perceptive modules which generates state predicates, reason about them, plan, and deliver emotionally intelligent action while interacting with human beings, emulating as much as possible human empathy.","2019-06","2021-05-19 12:41:49","2021-05-19 12:41:49","","36-42","","","","","","","","","","","","","","","","","","","","","","","","perception; emotions; communication; empathy; affect; Face; Face recognition; Speech recognition; Robot kinematics; human robot interaction; logic; Multi-agent systems; Skin","","","","","","","","","","","","","","","","","","","","","","","","","","","","","","","","","","","","","","","","","","","","","","",""
"3SIATJEC","conferencePaper","2018","Viet Tuyen, Nguyen Tan; Jeong, Sungmoon; Chong, Nak Young","Emotional Bodily Expressions for Culturally Competent Robots through Long Term Human-Robot Interaction","2018 IEEE/RSJ International Conference on Intelligent Robots and Systems (IROS)","","","10.1109/IROS.2018.8593974","","Generating emotional bodily expressions for culturally competent robots has been gaining increased attention to enhance the engagement and empathy between robots and humans in a multi-culture society. In this paper, we propose an incremental learning model for selecting the user's representative or habitual emotional behaviors which place emphasis on individual users' cultural traits identified through long term interaction. Furthermore, a transformation model is proposed to convert the obtained emotional behaviors into a specific robot's motion space. To validate the proposed approach, the models were evaluated by two example scenarios of interaction. The experimental results confirmed that the proposed approach endows a social robot with the capability to learn emotional behaviors from individual users, and to generate its emotional bodily expressions. It was also verified that the imitated robot motions are rated emotionally acceptable by the demonstrator and recognizable by the subjects from the same cultural background with the demonstrator.","2018-10","2021-05-19 12:41:49","2021-05-19 12:41:49","","2008-2013","","","","","","","","","","","","","","","","","","","","ISSN: 2153-0866","","","","Neurons; Training; Robot kinematics; Collision avoidance; Self-organizing feature maps; Trajectory","","","","","","","","","","","","","","","","","","","","","","","","","","","","","","","","","","","","","","","","","","","","","","",""
"69QVI7HE","conferencePaper","2018","Tuyen, Nguyen Tan Viet; Jeong, Sungmoon; Chong, Nak Young","Incremental Learning of Human Emotional Behavior for Social Robot Emotional Body Expression","2018 15th International Conference on Ubiquitous Robots (UR)","","","10.1109/URAI.2018.8441767","","Generating emotional body expressions for social robots has been gaining increased attention to enhance the engagement and empathy in human-robot interaction. In this paper, an enhanced model of robot emotional body expression is proposed which places emphasis on the individual user's cultural traits. Similar to our previous paper, this approach is inspired by social and emotional development of infants interacting with their parents who have a certain cultural background. Social referencing occurs when infants perceive their parents' facial expressions and vocal tones of emotional situations to form their own interpretation. On the other hand, this model replaces the batch learning self-organizing map with the dynamic cell structure, incrementally training a neural network model with a variety of emotional behaviors obtained from the users with whom the robot interacts. We demonstrate the validity of our incremental learning model through a public human action dataset, which will facilitate the acquisition of emotional body expression of socially assistive robots as a reflection of the individual user's culture.","2018-06","2021-05-19 12:41:49","2021-05-19 12:41:49","","377-382","","","","","","","","","","","","","","","","","","","","","","","","Neurons; Psychology; Training; Human-robot interaction; Robots; Cultural differences; Self-organizing feature maps","","","","","","","","","","","","","","","","","","","","","","","","","","","","","","","","","","","","","","","","","","","","","","",""
"36HL7VI9","conferencePaper","2019","Das, Amit Kumar; Ashrafi, Aziza; Ahmmad, Muktadir","Joint Cognition of Both Human and Machine for Predicting Criminal Punishment in Judicial System","2019 IEEE 4th International Conference on Computer and Communication Systems (ICCCS)","","","10.1109/CCOMS.2019.8821655","","Thousands of research have been taking place to develop advanced Artificial Intelligence System which can't only perform faster but also predict better than human. But a human has some qualities which can never be gained by a machine like creativity, empathy, sensing, and critical thinking. By aggregating the best sides of both, a novel paradigm for the judicial system can be anticipated. For this purpose, we prepare a dataset both from an online survey (n=103) and interviews conducted in Bangladesh on cases related to `Women and Children Repression Prevention Act, 2000'. We apply several machine learning algorithms to make a machine that can predict punishment like a judge and calculate both the test accuracy and the predictive power of the models to observe which algorithm performs better and stable than the others. Even human can guide machine for judging a delinquent.","2019-02","2021-05-19 12:41:49","2021-05-19 12:41:49","","36-40","","","","","","","","","","","","","","","","","","","","","","","","Task analysis; Decision making; Law; Case; Human Guided; Judge; Judicial System; Machine learning Framework; Predict Punishment; Forecasting; Machine intelligence; Machine learning algorithms; Predictive models","","","","","","","","","","","","","","","","","","","","","","","","","","","","","","","","","","","","","","","","","","","","","","",""
"GNPW45HQ","conferencePaper","2016","Shamsuddin, Syamimi; Ahmad, Intan Fatihah; Zulkifli, Winal Zikril; Hwee, Lim Thiam; Yussof, Hanafiah","Preliminary study on the use of therapeutic seal robot for patients with depression","2016 IEEE International Symposium on Robotics and Intelligent Sensors (IRIS)","","","10.1109/IRIS.2016.8066065","","Depression is a serious mental health challenge. If left untreated, it could lead to other critical symptoms, even suicide. In Malaysia, the prevalence is estimated between 8-10% of the population but it is often under-recognized and undertreated. This study is the first one in Malaysia to propose an animal robot to provide mental support to patients with depression. The main objective of this paper is to introduce PARO the seal robot as a remedy to reduce the need for psychotropic drugs during depression therapy at a rehabilitation center. Patients with depression requires repetitive conditioning and motivation. A robotic animal is a proposed solution to provide constant mental support and induce warm and empathetic feelings from the patients. Comparing assessment scores of pre and post robotic therapy shall shed light on the suitability of PARO to help patients with depression.","2016-12","2021-05-19 12:41:49","2021-05-19 12:41:49","","52-56","","","","","","","","","","","","","","","","","","","","","","","","Medical treatment; Animals; depression; rehabilitation; human-robot interaction; Senior citizens; Robot sensing systems; Dementia; PARO; robotic therapy; Seals","","","","","","","","","","","","","","","","","","","","","","","","","","","","","","","","","","","","","","","","","","","","","","",""
"5C74TCGY","conferencePaper","2017","Tuyen, Nguyen Tan Viet; Jeong, Sungmoon; Chong, Nak Young","Learning human behavior for emotional body expression in socially assistive robotics","2017 14th International Conference on Ubiquitous Robots and Ambient Intelligence (URAI)","","","10.1109/URAI.2017.7992882","","Generating emotional body expressions for socially assistive robots has been gaining increased attention to enhance the engagement and empathy in human-robot interaction. In this paper, we propose a new model of emotional body expression for the robot inspired by social and emotional development of infant from their parents. An infant is often influenced by social referencing, meaning that they perceive their parents' interpretation about emotional situations to form their own interpretation. Similar to the infant development case, robots can be designed to generate representative emotional behaviors using self-organized neural networks trained with various emotional behavior samples from human partners. We demonstrate the validity of our emotional behavior expression through a public human action dataset, which will facilitate the acquisition of emotional body expression of socially assistive robots.","2017-06","2021-05-19 12:41:49","2021-05-19 12:41:49","","45-50","","","","","","","","","","","","","","","","","","","","","","","","Neurons; Psychology; Training; human-robot interaction; Human-robot interaction; Robots; clustering; emotional body expression; imitation learning; Kernel; Skeleton","","","","","","","","","","","","","","","","","","","","","","","","","","","","","","","","","","","","","","","","","","","","","","",""
"PP59DJLJ","conferencePaper","2017","Kurashige, Kentarou; Tsuruta, Setsuo; Sakurai, Eriko; Sakurai, Yoshitaka; Knauf, Rainer; Damiani, Ernesto","Context respectful counseling agent integrated with robot nodding for dialog promotion","2017 IEEE International Conference on Systems, Man, and Cybernetics (SMC)","","","10.1109/SMC.2017.8122833","","Nowadays, a lot of IT personnel have psychological distress. Meanwhile, counselors to help them are lack in number. To solve the problem, we proposed a counseling agent (CA) called CRECA (context respectful counseling agent). CRECA listens to clients and promotes their reflection context respectfully namely in a context preserving way. This agent can be enhanced using a body language called ""unazuki"" in Japanese, a kind of ""nodding"" to greatly promote dialogue, often accompanying ""un-un"" (meaning ""exactly"") of Japanese onomatopoeia. This body language is expected to significantly help represent empathy or entire approval. In this paper, the agent is integrated with such a ""unazuki"" or ""dialog promotion nodding"" robot to continue the conversation naturally or context respectfully towards clients' further reflection. To realize such ""unazuki"", the robot nods twice at each end of dialog sentence input by clients. The experimental evaluation proves such nodding is effective in counseling.","2017-10","2021-05-19 12:41:49","2021-05-19 12:41:49","","1540-1545","","","","","","","","","","","","","","","","","","","","","","","","Cognition; Robots; Robot; Counseling; Dialog Promotion; Dictionaries; Employee welfare; Nodding; Ontologies; Reflection; unazuki; Problem-solving","","","","","","","","","","","","","","","","","","","","","","","","","","","","","","","","","","","","","","","","","","","","","","",""
"CUWTEXQ9","journalArticle","2016","Roudposhti, Kamrad Khoshhal; Nunes, Urbano; Dias, Jorge","Probabilistic Social Behavior Analysis by Exploring Body Motion-Based Patterns","IEEE Transactions on Pattern Analysis and Machine Intelligence","","1939-3539","10.1109/TPAMI.2015.2496209","","Understanding human behavior through nonverbal-based features, is interesting in several applications such as surveillance, ambient assisted living and human-robot interaction. In this article in order to analyze human behaviors in social context, we propose a new approach which explores interrelations between body part motions in scenarios with people doing a conversation. The novelty of this method is that we analyze body motion-based features in frequency domain to estimate different human social patterns: Interpersonal Behaviors (IBs) and a Social Role (SR). To analyze the dynamics and interrelations of people's body motions, a human movement descriptor is used to extract discriminative features, and a multi-layer Dynamic Bayesian Network (DBN) technique is proposed to model the existent dependencies. Laban Movement Analysis (LMA) is a well-known human movement descriptor, which provides efficient mid-level information of human body motions. The mid-level information is useful to extract the complex interdependencies. The DBN technique is tested in different scenarios to model the mentioned complex dependencies. The study is applied for obtaining four IBs (Interest, Indicator, Empathy and Emphasis) to estimate one SR (Leading).The obtained results give a good indication of the capabilities of the proposed approach for people interaction analysis with potential applications in human-robot interaction.","2016-08","2021-05-19 12:41:49","2021-05-19 12:41:49","","1679-1691","","8","38","","","","","","","","","","","","","","","","","","","","","Human-robot interaction; Three-dimensional displays; Shape; Feature extraction; Analytical models; Bayes methods; Bayesian approach; frequency domain; Histograms; human movement analysis; social role; Social signal processing","","","","","","","","","","","","","","","","","","","","","","","","","","","","","","","","","","","","","","","","","","","","","","",""
"6CKE67X2","conferencePaper","2016","Hervás, Ramón; Johnson, Esperanza; Gutierrez López de la Franca, Carlos; Bravo, José; Mondéjar, Tania","A Learning System to Support Social and Empathy Disorders Diagnosis through Affective Avatars","2016 15th International Conference on Ubiquitous Computing and Communications and 2016 International Symposium on Cyberspace and Security (IUCC-CSS)","","","10.1109/IUCC-CSS.2016.021","","Nowadays diagnosis and treatment of cognitive and physical health issues can be empowered through the use of information technologies. However, there is a significant gap between the potential of those technologies and the real application. One example is the use of serious games with health proposals, a trending research area still not implanted in health systems. This paper proposes the use of serious games, particularly an interactive and affective avatar-based application to support the diagnosis and treatment of empathy and socialization issues, in an autonomous way through the implementation of a learning algorithm based on the ground truth obtained from the evaluation with real users, including normotypical users, users with Down syndrome and users with intellectual disability.","2016-12","2021-05-19 12:41:49","2021-05-19 12:41:49","","93-100","","","","","","","","","","","","","","","","","","","","","","","","Object recognition; Psychology; Affective Computing; Machine Learning; Avatars; Games; Emotion recognition; Cognitive Health; Human-Avatar Interaction; Social Communication Disorders; Proposals; Taxonomy","","","","","","","","","","","","","","","","","","","","","","","","","","","","","","","","","","","","","","","","","","","","","","",""
"E2VS755N","conferencePaper","2015","Headleand, Christopher J.; Jackson, James; Priday, Lee; Teahan, William; Cenydd, Llyr Ap","Does the Perceived Identity of Non-player Characters Change How We Interact with Them?","2015 International Conference on Cyberworlds (CW)","","","10.1109/CW.2015.35","","Although there have been studies demonstrating that users will respond favorably to synthetic companions and team-mates in computer games, there has been little research into how a player's behavior may change when a known non-player character (NPC) assumes a human identity or persona. This is a common scenario in modern computer games, where players interact with NPCs assuming the guise of human characters. To explore this question, an online game was developed in which a human player had a primary objective of surviving against increasingly difficult waves of enemies. As a secondary objective, the player was tasked with protecting an unarmed NPC companion which assumed either a human, or non-human identity, but with identical underlying Artificial Intelligence. The intention was to explore whether the human player would be more or less protective of a synthetic companion simply due to the identity assumed. The results of the study demonstrate that player's behavior does change based on identity, and clearly indicates that the player was more protective of the companion assuming a human identity. Furthermore, the results show that this phenomenon extends beyond simple human and non-human identities, and that the specific persona, or gender of the NPC may influence the player's empathy towards it.","2015-10","2021-05-19 12:41:49","2021-05-19 12:41:49","","145-152","","","","","","","","","","","","","","","","","","","","","","","","Visualization; Artificial intelligence; Computers; Robots; Ash; Avatars; CASA; Games; Games AI; Human Agent Interaction; Identity; NPC","","","","","","","","","","","","","","","","","","","","","","","","","","","","","","","","","","","","","","","","","","","","","","",""
"5BK522QD","conferencePaper","2017","y Restrepo, Emmanuelle Gutiérrez; Boticario, Jesús G.","Responsive and responsible higher education through advanced technology Accessibility, empathy and diversity the keys of our future","2017 International Conference on Engineering, Technology and Innovation (ICE/ITMC)","","","10.1109/ICE.2017.8280067","","This paper explores the unexpected but fundamental relationship among the strategy defined for the Educational and Professional Development and Support Centres, results from the ACACIA European project, and the future of artificial intelligence. The purpose of this analysis is reducing their respective bias and improving their acuity. The lack of empathy detected by several studies among current young population along with non-inclusive design tendencies of current and upcoming intelligent systems give rise to a problem that we must tackle as soon as possible if we want to achieve a more inclusive society.","2017-06","2021-05-19 12:41:49","2021-05-19 12:41:49","","1552-1558","","","","","","","","","","","","","","","","","","","","","","","","Education; Artificial Intelligence; Empathy; Accessibility; Diversity; Afective computing; Assistive technology; Cultural differences; Economics; Gesture recognition; Intelligent systems","","","","","","","","","","","","","","","","","","","","","","","","","","","","","","","","","","","","","","","","","","","","","","",""
"4D8L7N55","conferencePaper","2019","Lopez-Martinez, Daniel; El-Haouij, Neska; Picard, Rosalind","Detection of Real-World Driving-Induced Affective State Using Physiological Signals and Multi-View Multi-Task Machine Learning","2019 8th International Conference on Affective Computing and Intelligent Interaction Workshops and Demos (ACIIW)","","","10.1109/ACIIW.2019.8925190","","Affective states have a critical role in driving performance and safety. They can degrade driver situation awareness and negatively impact cognitive processes, severely diminishing road safety. Therefore, detecting and assessing drivers' affective states is crucial in order to help improve the driving experience, and increase safety, comfort and well-being. Recent advances in affective computing have enabled the detection of such states. This may lead to empathic automotive user interfaces that account for the driver's emotional state and influence the driver in order to improve safety. In this work, we propose a multiview multi-task machine learning method for the detection of driver's affective states using physiological signals. The proposed approach is able to account for inter-drive variability in physiological responses while enabling interpretability of the learned models, a factor that is especially important in systems deployed in the real world. We evaluate the models on three different datasets containing real-world driving experiences. Our results indicate that accounting for drive-specific differences significantly improves model performance.","2019-09","2021-05-19 12:41:49","2021-05-19 12:41:49","","356-361","","","","","","","","","","","","","","","","","","","","","","","","Stress; Machine learning; Feature extraction; Heart rate; Physiology; Affective State; Databases; Multi-task Multi-view Machine Learning; Physiological data; Real-world driving; Vehicles","","","","","","","","","","","","","","","","","","","","","","","","","","","","","","","","","","","","","","","","","","","","","","",""
