"4XVUFQLF","conferencePaper","2020","Dixit, Rahul; Chinnam, Ratne Babu; Singh, Harpreet","Artificial Intelligence and Machine Learning in Sparse/Inaccurate Data Situations","2020 IEEE Aerospace Conference","","","10.1109/AERO47225.2020.9172612","","Machine Learning (ML) and other artificial Intelligence (AI) techniques have been developed for real-time decision making, and are gaining traction in data-rich situations. However, these techniques are less proven in sparse-data environments, and at present are more the subject of research than application. Typical implementations of ML and AI require a cross-disciplinary decision engine that, once “trained,” can cognitively respond to changes in input. The key to successful training is to a) have a defined decision-basis (answer-key), and/or b) facilitate sufficient learning, both of which require ample data (observability) and ample time for the machine to develop a logical outcome. Much research has been focused on developing decision algorithms using various logical formulations, dimensionality reductions, neural techniques, and learning reinforcements for tasks that traditionally require human intelligence. What is missing in most current research streams are implementations of ML and AI for decisions that are fundamentally rooted in human intuition and empathy, e.g., situations in which the decision requires a holistic view and the outcome is based on a qualitative judgement based on context and fact. This paper is intended to benefit a wide range of readers considering Artificial Intelligence, from the merely curious to “techies” from other disciplines to experienced practitioners and researchers. Using a qualitative/ characteristics base perspective of data and AI, we examine defense industry procurement, operational, tactical, and strategic decision scenarios, then identify where AI can currently promote better informed decisions and which arenas need would benefit by letting AI technology and sophistication evolve further.","2020-03","2021-05-19 12:41:48","2021-05-19 12:41:48","","1-8","","","","","","","","","","","","","","","","","","","","ISSN: 1095-323X","","","","","","","","","","","","","","","","","","","","","","","","","","","","","","","","","","","","","","","","","","","","","","","","","","",""
"DMJ6XBIE","conferencePaper","2015","Biswas, M.; Murray, J.C.","Towards an imperfect robot for long-term companionship: case studies using cognitive biases","2015 IEEE/RSJ International Conference on Intelligent Robots and Systems (IROS)","","","10.1109/IROS.2015.7354228","","The research presented in this paper aims to find out what affect cognitive biases play in a robot's interactive behaviour for the goal of developing human-robot long-term companionship. It is expected that by utilising cognitive biases in a robot's interactive behaviours, making the robot cognitively imperfect, will affect how people relate to the robot thereby changing the process of long-term companionship. Previous research carried out in this area based on human-like cognitive characteristics in robots to create and maintain long-term relationship between robots and humans have yet to focus on developing human-like cognitive biases and as such is new to this application in robotics. To start working with cognitive biases `misattribution' and `empathic gap' have been selected which have been shown to be very common biases in humans and as such play a role on human-human interactions and long-term relationships.","2015-09","2021-05-19 12:41:48","2021-05-19 12:41:48","","5978-5983","","","","","","","","","","","","","","","","","","","","","","","","Human-robot interaction; Service robots; Atmospheric measurements; Anthropomorphism; Human-Robot Interaction; Speech; Cognitive Bias; Correlation; Empathic Gap; Human-Robot Long-term Companionship; Imperfect Robots; Misattribution","","","","","","","","","","","","","","","","","","","","","","","","","","","","","","","","","","","","","","","","","","","","","","",""
"I7QDWCM9","conferencePaper","2018","Churamani, Nikhil; Barros, Pablo; Strahl, Erik; Wermter, Stefan","Learning Empathy-Driven Emotion Expressions using Affective Modulations","2018 International Joint Conference on Neural Networks (IJCNN)","","","10.1109/IJCNN.2018.8489158","","Human-Robot Interaction (HRI) studies, particularly the ones designed around social robots, use emotions as important building blocks for interaction design. In order to provide a natural interaction experience, these social robots need to recognise the emotions expressed by the users across various modalities of communication and use them to estimate an internal affective model of the interaction. These internal emotions act as motivation for learning to respond to the user in different situations, using the physical capabilities of the robot. This paper proposes a deep hybrid neural model for multi-modal affect recognition, analysis and behaviour modelling in social robots. The model uses growing self-organising network models to encode intrinsic affective states for the robot. These intrinsic states are used to train a reinforcement learning model to learn facial expression representations on the Neuro-Inspired Companion (NICO) robot, enabling the robot to express empathy towards the users.","2018-07","2021-05-19 12:41:48","2021-05-19 12:41:48","","1-8","","","","","","","","","","","","","","","","","","","","ISSN: 2161-4407","","","","Neurons; Adaptation models; Emotion recognition; Robot sensing systems; Mood; Convolution","","","","","","","","","","","","","","","","","","","","","","","","","","","","","","","","","","","","","","","","","","","","","","",""
"QNXDM9N4","conferencePaper","2018","Kühnlenz, Barbara; Kühnlenz, Kolja; Busse, Fabian; Förtsch, Pascal; Wolf, Maximilian","Effect of Explicit Emotional Adaptation on Prosocial Behavior of Humans towards Robots depends on Prior Robot Experience","2018 27th IEEE International Symposium on Robot and Human Interactive Communication (RO-MAN)","","","10.1109/ROMAN.2018.8525515","","Emotional adaptation increases pro-social behavior of humans towards robotic interaction partners. Social cues are an important factor in this context. This work investigates, if emotional adaptation still works under absence of human-like facial Action Units. A human-robot dialog scenario is chosen using NAO pretending to work for a supermarket and involving humans providing object names to the robot for training purposes. In a user study, two conditions are implemented with or without explicit emotional adaptation of NAO to the human user in a between-subjects design. Evaluations of user experience and acceptance are conducted based on evaluated measures of human-robot interaction (HRI). The results of the user study reveal a significant increase of helpfulness (number of named objects), anthropomorphism, and empathy in the explicit emotional adaptation condition even without social cues of facial Action Units, but only in case of prior robot contact of the test persons. Otherwise, an opposite effect is found. These findings suggest, that reduction of these social cues can be overcome by robot experience prior to the interaction task, e.g. realizable by an additional bonding phase, confirming the importance of such from previous work. Additionally, an interaction with academic background of the participants is found.","2018-08","2021-05-19 12:41:48","2021-05-19 12:41:48","","275-281","","","","","","","","","","","","","","","","","","","","ISSN: 1944-9437","","","","Task analysis; Robots; Anthropomorphism; Mood; Color; Communication channels","","","","","","","","","","","","","","","","","","","","","","","","","","","","","","","","","","","","","","","","","","","","","","",""
"PZ5S93HH","conferencePaper","2018","Carranza, Karmelo Antonio R.; Day, Nicole Jillian B.; Lin, Lawrence Matthew S.; Ponce, Albert R.; Reyes, Wilbur Rex O.; Abad, Alexander C.; Baldovino, Renann G.","Akibot: A Telepresence Robot for Medical Teleconsultation","2018 IEEE 10th International Conference on Humanoid, Nanotechnology, Information Technology,Communication and Control, Environment and Management (HNICEM)","","","10.1109/HNICEM.2018.8666283","","One problem in the healthcare industry in the Philippines is the maldistribution of doctors. This greatly affects the accessibility of patients to proper healthcare. As a matter of fact, in 2015, 59.2% of deaths in the Philippines are attributed as deaths unattended by a doctor. Although there are current government programs, which aim to solve this problem, the use of telepresence systems can be another viable solution as doctors can still provide quality healthcare services even when located in a remote area. One limitation of medical telepresence robots is the lack of medical features. For this reason, the developed telepresence system includes a telepresence robot called Akibot with integrated medical devices such as otoscope, stethoscope, and ultrasound probe. Akibot is a highly maneuverable remotely controlled telepresence robot designed for general practice medical consultation between doctors and a patient on a remote area. Akibot has an empathic exterior with 4.6 out of 5 rating on its perceived quality of appearance and is equipped with modular medical devices and highly customizable screen, tested on an Android and Windows OS.","2018-11","2021-05-19 12:41:48","2021-05-19 12:41:48","","1-4","","","","","","","","","","","","","","","","","","","","","","","","Medical diagnostic imaging; Medical services; DC motors; Telepresence; Delays; general practice medical consultation; human-centered robot design; Robot control; teleconsultation; telepresence robot","","","","","","","","","","","","","","","","","","","","","","","","","","","","","","","","","","","","","","","","","","","","","","",""
"PLVXYKX4","conferencePaper","2018","Kurashige, Kentarou; Tsuruta, Setsuo; Sakurai, Eriko; Sakurai, Yoshitaka; Knauf, Rainer; Damiani, Ernesto; Kutics, Andrea","Counseling Robot Implementation and Evaluation","2018 IEEE International Conference on Systems, Man, and Cybernetics (SMC)","","","10.1109/SMC.2018.00297","","A lot of IT personnel have psychological distress and counselors to help them are lack in number. Therefore, we proposed a counseling agent (CA) called CRECA (context respectful counseling agent), which listens to clients and promotes their reflection context respectfully namely in a context preserving way. This agent is now enhanced using a body language called ""unazuki"" in Japanese, a kind of nodding to greatly promote dialogue, often accompanying ""un-un"" (meaning ""exactly"") of Japanese onomatopoeia. This body language significantly helps represent empathy or entire approval. Our agent is enhanced with such dialog promotion nodding robot to continue the conversation naturally or context respectfully towards clients' further reflection. To realize it, the robot nods twice at each end of dialog sentence input by clients. Here, we introduce a robot that behaves human-like by an appropriate nodding behavior. The motivation for such a more human-like robot was the extension of application fields from IT workers' counselling to people, who suffer from more social problems such as financial debt, or anxiety of victory or defeat. For such applications, it is important that the agent behaves as much as possible human-like. Here, we present an enhanced experimental evaluation. The quantitative evaluation is based on the utterance amounts of a test group of individuals. These amount with and without the nodding feature are compared. Additionally, the robots with and without nodding are compared.","2018-10","2021-05-19 12:41:48","2021-05-19 12:41:48","","1716-1722","","","","","","","","","","","","","","","","","","","","ISSN: 2577-1655","","","","Robot sensing systems; Robot; Counseling; Dialog Promotion; Dictionaries; Employee welfare; Natural languages; Nodding; Ontologies; Reflection; unazuki","","","","","","","","","","","","","","","","","","","","","","","","","","","","","","","","","","","","","","","","","","","","","","",""
"RUAWPIJA","conferencePaper","2017","Anshar, Muh; Williams, Mary-Anne","Evolving artificial pain from fault detection through pattern data analysis","2017 IEEE International Conference on Real-time Computing and Robotics (RCAR)","","","10.1109/RCAR.2017.8311945","","Fault detection is a classical area of study in robotics and extensive research works have been dedicated to investigate its broad applications. As the breath of robots applications requiring human interaction grow, it is important for robots to acquire sophisticated social skills such as empathy towards pain. However, it turns out that this is difficult to achieve without having an appropriate concept of pain that relies on robots being aware of their own body machinery aspects. This paper introduces the concept of pain, based on the ability to develop a state of awareness of robots own body and the use of the fault detection approach to generate artificial robot pain. Faults provide the stimulus and defines a classified magnitude value, which constitutes artificial pain generation, comprised of synthetic pain classes. Our experiment evaluates some of synthetic pain classes and the results show that the robot gains awareness of its internal state through its ability to predict its joint motion and generate appropriate artificial pain. The robot is also capable of alerting humans whenever a task will generate artificial pain, or whenever humans fails to acknowledge the alert, the robot can take a considerable preventive actions through joint stiffness adjustment.","2017-07","2021-05-19 12:41:48","2021-05-19 12:41:48","","694-699","","","","","","","","","","","","","","","","","","","","","","","","Pain; Robot sensing systems; Data analysis; Machinery; Planning","","","","","","","","","","","","","","","","","","","","","","","","","","","","","","","","","","","","","","","","","","","","","","",""
"6ZN5SS4F","conferencePaper","2018","Iranzo, Rosa M. Gil; Padilla-Zea, Natalia; Paderewski-Rodríguez, Patricia; González-González, Carina S.","Empathy and virtual agents for learning applications in symbiotic systems","2018 IEEE Global Engineering Education Conference (EDUCON)","","","10.1109/EDUCON.2018.8363298","","Transparency and ethics are the key issues to improve in the future generations of bots and robots. Communication between users and bots or robots must be clear and transparent to be audited. Empathy will be a valuable asset in a symbiotic domain (user/bot, bot/bot, bot/robot, robot/robot, user/robot). We expose some guidelines to UX designers to cope to new paradigms in HCI communication challenges.","2018-04","2021-05-19 12:41:49","2021-05-19 12:41:49","","694-697","","","","","","","","","","","","","","","","","","","","ISSN: 2165-9567","","","","Ethics; ethics; empathy; Robots; robot; Observers; Biometrics (access control); bot; Guidelines; Privacy; Symbiosis; symbiotic agents; transparency","","","","","","","","","","","","","","","","","","","","","","","","","","","","","","","","","","","","","","","","","","","","","","",""
"R4D7K75W","conferencePaper","2021","Abraham, Geo; Nithya, M.","Multi-Functional Personal Assistant Robot Using Raspberry Pi and Coral Accelerator","2021 5th International Conference on Computing Methodologies and Communication (ICCMC)","","","10.1109/ICCMC51019.2021.9418299","","In the present day scenario, a human-like personal assistant robot would ease man’s life with his day-to-day activities and aid him to make up for the lost time spent in inefficient means of calculations and other dependencies. This research work stirs plans to develop a personal assistant robot that has following features. The robot can perceive normal objects that are seen in day-to-day lives and can pass on the information as voice messages which can significantly help old and outwardly impeded individuals. It can read out text messages from an image which again can significantly help old and outwardly impeded individuals. It acts as an empathy robot by perceiving facial feelings and is programmed to play some music according to the detected emotion of the user. It also can find out whether the user is wearing a mask and if not can give an alert voice message. Lastly, it can also has Amazon Alexa speech assistant technology.","2021-04","2021-05-19 12:41:49","2021-05-19 12:41:49","","638-643","","","","","","","","","","","","","","","","","","","","","","","","Object recognition; Emotion Recognition; Robots; Acceleration; CNN; coral USB accelerator; Mask Detection; Personal assistant Robot; Raspberry Pi; Universal Serial Bus; Virtual assistants","","","","","","","","","","","","","","","","","","","","","","","","","","","","","","","","","","","","","","","","","","","","","","",""
"AI7ZW4WB","conferencePaper","2015","Hood, Deanna; Lemaignan, Séverin; Dillenbourg, Pierre","When Children Teach a Robot to Write: An Autonomous Teachable Humanoid Which Uses Simulated Handwriting","2015 10th ACM/IEEE International Conference on Human-Robot Interaction (HRI)","","","","","This article presents a novel robotic partner which children can teach handwriting. The system relies on the learning by teaching paradigm to build an interaction, so as to stimulate meta-cognition, empathy and increased self-esteem in the child user. We hypothesise that use of a humanoid robot in such a system could not just engage an unmotivated student, but could also present the opportunity for children to experience physically-induced benefits encountered during human-led handwriting interventions, such as motor mimicry.By leveraging simulated handwriting on a synchronised tablet display, a NAo humanoid robot with limited fine motor capabilities has been configured as a suitably embodied handwriting partner. Statistical shape models derived from principal component analysis of a dataset of adult-written letter trajectories allow the robot to draw purposefully deformed letters. By incorporating feedback from user demonstrations, the system is then able to learn the optimal parameters for the appropriate shape models.Preliminary in situ studies have been conducted with primary school classes to obtain insight into children's use of the novel system. Children aged 6-8 successfully engaged with the robot and improved its writing to a level which they were satisfied with. The validation of the interaction represents a significant step towards an innovative use for robotics which addresses a widespread and socially meaningful challenge in education.","2015-03","2021-05-19 12:41:49","2021-05-19 12:41:49","","83-90","","","","","","","","","","","","","","","","","","","","ISSN: 2167-2121","","","","Education; Humanoid robots; Mathematical model; Shape; Principal component analysis; Writing","","","","","","","","","","","","","","","","","","","","","","","","","","","","","","","","","","","","","","","","","","","","","","",""
"3UM925LX","conferencePaper","2017","Kurashige, Kentarou; Tsuruta, Setsuo; Sakurai, Eriko; Sakurai, Yoshitaka; Knauf, Rainer; Damiani, Ernesto","Design of Counseling Robot for Production by 3D Printer","2017 13th International Conference on Signal-Image Technology Internet-Based Systems (SITIS)","","","10.1109/SITIS.2017.20","","Nowadays, a lot of IT personnel have psychological distress. Meanwhile, counselors to help them are lack in number. To solve the problem, we proposed a counseling agent (CA) called CRECA (context respectful counseling agent). CRECA listens to clients and promotes their reflection context respectfully namely in a context preserving way. This agent can be enhanced using a body language called “unazuki” in Japanese, a kind of “nodding” to greatly promote dialogue, often accompanying “un-un” (meaning “exactly”) of Japanese onomatopoeia. This body language is expected to significantly help represent empathy or entire approval. In this paper, the agent is integrated with such a “unazuki” or “dialog promotion nodding” robot to continue the conversation naturally or context respectfully towards clients' further reflection. To realize such “unazuki”, the robot nods twice at each end of dialog sentence input by clients. Here, we introduce our newly developed robot that behaves human-like by an appropriate nodding behavior. The main motivation for developing a more human-like robot was the extension of application fields from IT workers' counselling to people, who suffers from more social problems such as financial debt, or anxiety of victory or defeat. For such applications, it is often very important that the agent behaves as much as possible human-like. Finally, we present the experimental evaluation results that proves such nodding is effective in counseling.","2017-12","2021-05-19 12:41:49","2021-05-19 12:41:49","","56-62","","","","","","","","","","","","","","","","","","","","","","","","Psychology; Cognition; Robots; Emotion recognition; Robot; Counseling; Dialog Promotion; Employee welfare; Nodding; Reflection; unazuki; Problem-solving","","","","","","","","","","","","","","","","","","","","","","","","","","","","","","","","","","","","","","","","","","","","","","",""
"QRTPYWQI","conferencePaper","2015","Mennesson, José; Allaert, Benjamin; Bilasco, Ioan Marius; van der Aa, Nico; Denis, Alexandre; Cruz-Lara, Samuel","Faces and thoughts: An empathic dairy","2015 11th IEEE International Conference and Workshops on Automatic Face and Gesture Recognition (FG)","","","10.1109/FG.2015.7163170","","Many diary apps have been developed for an Android mobile device. Although most concentrate on securing the privacy and adding emoticons, only a few include automatic emotion measurements. This demo shows a new diary app including real-time multi-modal emotion measurements to capture the affective state of the user from the text provided and video images made. The emotion measurements from the Emotion from Face module, that analyzes images from the front camera [1], and the Emotion from Text module, that analyzes the text written by the user [2], are merged within the Emotion Fusion module to estimate the user's affective state more robustly. The app allows the user to have empathic feedback for each session.","2015-05","2021-05-19 12:41:49","2021-05-19 12:41:49","","1-1","","","1","","","","","","","","","","","","","","","","","","","","","Computer architecture; Sentiment analysis; Conferences; Real-time systems; Information technology; Smart phones","","","","","","","","","","","","","","","","","","","","","","","","","","","","","","","","","","","","","","","","","","","","","","",""
"NH4E4QR9","conferencePaper","2019","Ghandeharioun, Asma; McDuff, Daniel; Czerwinski, Mary; Rowan, Kael","EMMA: An Emotion-Aware Wellbeing Chatbot","2019 8th International Conference on Affective Computing and Intelligent Interaction (ACII)","","","10.1109/ACII.2019.8925455","","The delivery of mental health interventions via ubiquitous devices has shown much promise. A conversational chatbot is a promising oracle for delivering appropriate just-in-time interventions. However, designing emotionally-aware agents, specially in this context, is under-explored. Furthermore, the feasibility of automating the delivery of just-in-time mHealth interventions via such an agent has not been fully studied. In this paper, we present the design and evaluation of EMMA (EMotion-Aware mHealth Agent) through a two-week long human-subject experiment with N=39 participants. EMMA provides emotionally appropriate micro-activities in an empathetic manner. We show that the system can be extended to detect a user's mood purely from smartphone sensor data. Our results show that our personalized machine learning model was perceived as likable via self-reports of emotion from users. Finally, we provide a set of guidelines for the design of emotion-aware bots for mHealth.","2019-09","2021-05-19 12:41:49","2021-05-19 12:41:49","","1-7","","","","","","","","","","","","","","","","","","","","ISSN: 2156-8111","","","","Stress; Medical treatment; Machine learning; Affective computing; emotional intelligence; affective computing; mental health; Mood; Intelligent agents; Mobile applications; agent; Sociology","","","","","","","","","","","","","","","","","","","","","","","","","","","","","","","","","","","","","","","","","","","","","","",""
"FURM7PEJ","conferencePaper","2016","Hall, Lynne; Hume, Colette; Tazzyman, Sarah; Deshmukh, Amol; Janarthanam, Srinivasan; Hastie, Helen; Aylett, Ruth; Castellano, Ginevra; Papadopoulos, Fotis; Jones, Aidan; Corrigan, Lee J.; Paiva, Ana; Oliveira, Patrícia Alves; Ribeiro, Tiago; Barendregt, Wolmet; Serholt, Sofia; Kappas, Arvid","Map reading with an empathic robot tutor","2016 11th ACM/IEEE International Conference on Human-Robot Interaction (HRI)","","","10.1109/HRI.2016.7451859","","In this video submission, we describe a scenario developed in the EMOTE project. The overall goal of the EMOTE project is to develop an empathic robot tutor for 11-13 year old school students in an educational setting. The pedagogical domain here is to assist students in learning and testing their map-reading skills typically learned as part of the geography curriculum in schools. We show this scenario with a NAO robot interacting with the students whilst performing map-reading tasks on a touch-screen device in this video.","2016-03","2021-05-19 12:41:49","2021-05-19 12:41:49","","567-567","","","","","","","","","","","","","","","","","","","","ISSN: 2167-2148","","","","Context; Psychology; empathy; Computers; Robots; robot-child interaction; robotic tutor; Art; Jacobian matrices; Systems engineering and theory","","","","","","","","","","","","","","","","","","","","","","","","","","","","","","","","","","","","","","","","","","","","","","",""
