Title,Citations,Author,Publication Title,Publication Year,Item Type,ISBN,ISSN,DOI,Url,Abstract Note,Date,Date Added,Date Modified,Access Date,Pages,Num Pages,Issue,Volume,Number Of Volumes,Journal Abbreviation,Short Title,Series,Series Number,Series Text,Series Title,Publisher,Place,Language,Rights,Type,Archive,Archive Location,Library Catalog,Call Number,Extra,Notes,File Attachments,Link Attachments,Manual Tags,Automatic Tags,Editor,Series Editor,Translator,Contributor,Attorney Agent,Book Author,Cast Member,Commenter,Composer,Cosponsor,Counsel,Interviewer,Producer,Recipient,Reviewed Author,Scriptwriter,Words By,Guest,Number,Edition,Running Time,Scale,Medium,Artwork Size,Filing Date,Application Number,Assignee,Issuing Authority,Country,Meeting Name,Conference Name,Court,References,Reporter,Legal Status,Priority Numbers,Programming Language,Version,System,Code,Code Number,Section,Session,Committee,History,Legislative Body,Title Duplicate,TA Keyword
Robot Mirroring: Promoting Empathy with an Artificial Agent by Reflecting the User's Physiological Affective States,0,"Perusquia-Hernandez, Monica; Balda, Marisabel Cuberos; Jauregui, David Antonio Gomez; Paez-Granados, Diego; Dollack, Felix; Salazar, Jose Victorio",2020 29TH IEEE INTERNATIONAL CONFERENCE ON ROBOT AND HUMAN INTERACTIVE COMMUNICATION (RO-MAN),2020,conferencePaper,978-1-72816-075-7,,10.1109/RO-MAN47096.2020.9223598,,"Self-tracking aims to increase awareness, decrease undesired behaviors, and ultimately lead towards a healthier lifestyle. However, inappropriate communication of self-tracking results might cause the opposite effect. Subtle self-tracking feedback is an alternative that can be provided with the aid of an artificial agent representing the self. Hence, we propose a wearable pet that reflects the user's affective states through visual and haptic feedback. By eliciting empathy and fostering helping behaviors towards it, users would indirectly help themselves. A wearable prototype was built, and three user studies performed to evaluate the appropriateness of the proposed affective representations. Visual representations using facial and body cues were clear for valence and less clear for arousal. Haptic interoceptive patterns emulating heart-rate levels matched the desired feedback urgency levels with a saturation frequency. The integrated visuo-haptic representations matched to participants own affective experience. From the results, we derived three design guidelines for future robot mirroring wearable systems: physical embodiment, interoceptive feedback, and customization.",2020,2021-04-19T15:56:11Z,2021-04-19T15:56:11Z,,1328-1333,6,,,,,,IEEE RO-MAN,,,,IEEE,"345 E 47TH ST, NEW YORK, NY 10017 USA",English,,,,,,,Backup Publisher: IEEE; IEEE Robot & Automat Soc; Robot Soc Japan; Korean Robot Soc; Furhat Robot; EurAi; Assoc Italiana Lingusitica Computazionale; Assoc Italiana Scienze Voce; Springer; Robotics ISSN: 1944-9445 Type: Proceedings Paper,"<p>29th IEEE International Conference on Robot and Human Interactive Communication (IEEE RO-MAN), ELECTR NETWORK, AUG 31-SEP 04, 2020</p>",,,,embodiment; empathy and intersubjectivity; haptic feedback; human-machine interaction,,,,,,,,,,,,,,,,,,,,,,,,,,,,,,,,,,,,,,,,,,,,,,,robotmirroringpromotingempathywithanartificialagentbyreflectingtheusersphysiologicalaffectivestates,robot mirroring promoting empathy with an artificial agent by reflecting the users physiological affective states selftracking aims to increase awareness decrease undesired behaviors and ultimately lead towards a healthier lifestyle however inappropriate communication of selftracking results might cause the opposite effect subtle selftracking feedback is an alternative that can be provided with the aid of an artificial agent representing the self hence we propose a wearable pet that reflects the users affective states through visual and haptic feedback by eliciting empathy and fostering helping behaviors towards it users would indirectly help themselves a wearable prototype was built and three user studies performed to evaluate the appropriateness of the proposed affective representations visual representations using facial and body cues were clear for valence and less clear for arousal haptic interoceptive patterns emulating heartrate levels matched the desired feedback urgency levels with a saturation frequency the integrated visuohaptic representations matched to participants own affective experience from the results we derived three design guidelines for future robot mirroring wearable systems physical embodiment interoceptive feedback and customization
Ideal Warrior and Robot Relations: Stress and Empathy's Role in Human-Robot Teaming,1,"Peterson, Jordan; Cohen, Chase; Harrison, Paige; Novak, Jonathan; Tossell, Chad; Phillips, Elizabeth",2019 SYSTEMS AND INFORMATION ENGINEERING DESIGN SYMPOSIUM (SIEDS),2019,conferencePaper,978-1-72810-998-5,,10.1109/SIEDS.2019.8735613,,"The battlefield of the future will look very different than the battlefields of the past. Automated technologies are finding themselves more and more integrated into every aspect of the fight. As technology continues to advance, the United States Military must consider what a human-machine team will look like and how an optimal relationship between the two assets can be formed, especially under the stressful conditions that often characterize military contexts. For a human-machine team in a military context to work at maximum efficiency, an ideal level of empathy towards an automated teammate must be obtained. The goal of this study is to determine the effect stress can have on an individual's empathetic reaction toward a Pepper robot. Twenty-eight participants interacted with a Pepper robot either under stress or not. Empathy toward the robot was measured through subjective assessments as well as by participant decisions to continue interacting with Pepper even though doing so would harm the robot. Although not conclusive, the results suggest an interaction between participant gender and stress on empathy toward the Pepper robot. Women showed more empathy toward Pepper under higher levels of stress than lower levels of stress. However, the opposite was true for men. Men showed less empathy toward Pepper under higher levels of stress. The results of this study could help to inform military training and robot design.",2019,2021-04-19T15:56:32Z,2021-04-19T15:56:32Z,,170-175,6,,,,,,IEEE Systems and Information Engineering Design Symposium,,,,IEEE,"345 E 47TH ST, NEW YORK, NY 10017 USA",English,,,,,,,ISSN: 2639-7439 Type: Proceedings Paper,"<p>Systems and Information Engineering Design Symposium (SIEDS), Univ Virginia, Charlottesville, VA, APR 26, 2019</p>",,,,Human-machine teaming; Human-robot interaction,,,,,,,,,,,,,,,,,,,,,,,,,,,,,,,,,,,,,,,,,,,,,,,idealwarriorandrobotrelationsstressandempathysroleinhumanrobotteaming,ideal warrior and robot relations stress and empathys role in humanrobot teaming the battlefield of the future will look very different than the battlefields of the past automated technologies are finding themselves more and more integrated into every aspect of the fight as technology continues to advance the united states military must consider what a humanmachine team will look like and how an optimal relationship between the two assets can be formed especially under the stressful conditions that often characterize military contexts for a humanmachine team in a military context to work at maximum efficiency an ideal level of empathy towards an automated teammate must be obtained the goal of this study is to determine the effect stress can have on an individuals empathetic reaction toward a pepper robot twentyeight participants interacted with a pepper robot either under stress or not empathy toward the robot was measured through subjective assessments as well as by participant decisions to continue interacting with pepper even though doing so would harm the robot although not conclusive the results suggest an interaction between participant gender and stress on empathy toward the pepper robot women showed more empathy toward pepper under higher levels of stress than lower levels of stress however the opposite was true for men men showed less empathy toward pepper under higher levels of stress the results of this study could help to inform military training and robot design
Towards a Robot Computational Model to Preserve Dignity in Stigmatizing Patient-Caregiver Relationships,7,"Pettinati, Michael J.; Arkin, Ronald C.",SOCIAL ROBOTICS (ICSR 2015),2015,conferencePaper,978-3-319-25554-5 978-3-319-25553-8,,10.1007/978-3-319-25554-5_53,,"Parkinson's disease (PD) patients with an expressive mask are particularly vulnerable to stigmatization during interactions with their caregivers due to their inability to express affect through nonverbal channels. Our approach to uphold PD patient dignity is through the use of an ethical robot that mediates patient shame when it recognizes norm violations in the patient-caregiver interaction. This paper presents the basis for a computational model tasked with computing patient shame and the empathetic response of a caregiver during “empathetic opportunities” in their interaction. A PD patient is liable to suffer indignity when there is a substantial difference between his experienced shame and the empathy shown by the caregiver. When this difference falls outside of acceptable set bounds (norms), the robotic agent will act using subtle, nonverbal cues to guide the relationship back within these bounds, preserving patient dignity.",2015,2021-04-19T15:57:44Z,2021-04-19T15:57:44Z,,532-542,11,,9388,,,,Lecture Notes in Artificial Intelligence,,,,SPRINGER-VERLAG BERLIN,"HEIDELBERGER PLATZ 3, D-14197 BERLIN, GERMANY",English,,,,,,,ISSN: 0302-9743 Type: Proceedings Paper,"<p>7th International Conference on Social Robotics (ICSR), Paris, FRANCE, OCT 26-30, 2015</p>",,,,,"Tapus, A and Andre, E and Martin, JC and Ferland, F and Ammi, M",,,,,,,,,,,,,,,,,,,,,,,,,,,,,,,,,,,,,,,,,,,,,,towardsarobotcomputationalmodeltopreservedignityinstigmatizingpatientcaregiverrelationships,towards a robot computational model to preserve dignity in stigmatizing patientcaregiver relationships parkinsons disease pd patients with an expressive mask are particularly vulnerable to stigmatization during interactions with their caregivers due to their inability to express affect through nonverbal channels our approach to uphold pd patient dignity is through the use of an ethical robot that mediates patient shame when it recognizes norm violations in the patientcaregiver interaction this paper presents the basis for a computational model tasked with computing patient shame and the empathetic response of a caregiver during empathetic opportunities in their interaction a pd patient is liable to suffer indignity when there is a substantial difference between his experienced shame and the empathy shown by the caregiver when this difference falls outside of acceptable set bounds norms the robotic agent will act using subtle nonverbal cues to guide the relationship back within these bounds preserving patient dignity
Evaluation of Classifiers for Emotion Detection While Performing Physical and Visual Tasks: Tower of Hanoi and IAPS,0,"Qureshi, Shahnawaz; Hagelback, Johan; Iqbal, Syed Muhammad Zeeshan; Javaid, Hamad; Lindley, Craig A.","IN℡LIGENT SYSTEMS AND APPLICATIONS, VOL 1",2019,conferencePaper,978-3-030-01054-6 978-3-030-01053-9,,10.1007/978-3-030-01054-6_25,,"With the advancement in robot technology, smart human-robot interaction is of increasing importance for allowing the more excellent use of robots integrated into human environments and activities. If a robot can identify emotions and intentions of a human interacting with it, interactions with humans can potentially become more natural and effective. However, mechanisms of perception and empathy used by humans to achieve this understanding may not be suitable or adequate for use within robots. Electroencephalography (EEG) can be used for recording signals revealing emotions and motivations from a human brain. This study aimed to evaluate different machine learning techniques to classify EEG data associated with specific affective/emotional states. For experimental purposes, we used visual (IAPS) and physical (Tower of Hanoi) tasks to record human emotional states in the form of EEG data. The obtained EEG data processed, formatted and evaluated using various machine learning techniques to find out which method can most accurately classify EEG data according to associated affective/emotional states. The experiment confirms the choice of a method for improving the accuracy of results. According to the results, Support Vector Machine was the first, and Regression Tree was the second best method for classifying EEG data associated with specific affective/emotional states with accuracies up to 70.00% and 60.00%, respectively. In both tasks, SVM was better in performance than RT.",2019,2021-04-19T15:56:24Z,2021-04-19T15:56:24Z,,347-363,17,,868,,,,Advances in Intelligent Systems and Computing,,,,SPRINGER INTERNATIONAL PUBLISHING AG,"GEWERBESTRASSE 11, CHAM, CH-6330, SWITZERLAND",English,,,,,,,ISSN: 2194-5357 Type: Proceedings Paper,"<p>Intelligent Systems Conference (IntelliSys), London, ENGLAND, SEP 06-07, 2018</p>",,,,Artificial Neural Networks (ANN); Bayesian Network (BNT); Cognitive psychology; Electroencephalography (EEG); Human Computer Interaction (HCI); K-Nearest Neighbor (KNN); Regression Tree (RT); Support Vector Machine (SVM); Tower of Hanoi (ToH),"Arai, K and Kapoor, S and Bhatia, R",,,,,,,,,,,,,,,,,,,,,,,,,,,,,,,,,,,,,,,,,,,,,,evaluationofclassifiersforemotiondetectionwhileperformingphysicalandvisualtaskstowerofhanoiandiaps,evaluation of classifiers for emotion detection while performing physical and visual tasks tower of hanoi and iaps with the advancement in robot technology smart humanrobot interaction is of increasing importance for allowing the more excellent use of robots integrated into human environments and activities if a robot can identify emotions and intentions of a human interacting with it interactions with humans can potentially become more natural and effective however mechanisms of perception and empathy used by humans to achieve this understanding may not be suitable or adequate for use within robots electroencephalography eeg can be used for recording signals revealing emotions and motivations from a human brain this study aimed to evaluate different machine learning techniques to classify eeg data associated with specific affectiveemotional states for experimental purposes we used visual iaps and physical tower of hanoi tasks to record human emotional states in the form of eeg data the obtained eeg data processed formatted and evaluated using various machine learning techniques to find out which method can most accurately classify eeg data according to associated affectiveemotional states the experiment confirms the choice of a method for improving the accuracy of results according to the results support vector machine was the first and regression tree was the second best method for classifying eeg data associated with specific affectiveemotional states with accuracies up to 7000 and 6000 respectively in both tasks svm was better in performance than rt
An Emotion-Based Interaction Strategy to Improve Human-Robot Interaction,4,"Ranieri, Caetano M.; Romero, Roseli A. F.",PROCEEDINGS OF 13TH LATIN AMERICAN ROBOTICS SYMPOSIUM AND 4TH BRAZILIAN SYMPOSIUM ON ROBOTICS - LARS/SBR 2016,2016,conferencePaper,978-1-5090-3656-1,,10.1109/LARS-SBR.2016.13,,"Emotion and empathy are key subjects on human-robot interaction, especially regarding social robots. Several studies have investigated emotional reactions of humans toward robots, while others deal with development of actual systems to analyze how affective feedback may influence this kind of interaction. This paper presents an emotion-aware interaction strategy applied to an embodied virtual agent, implemented as an Android application. The system assigns two distinct paradigms to the virtual character, according to the user's emotion, inferred through facial expressions analysis. Within subject user experiments have been performed, in order to evaluate if the proposed strategy improves empathy and pleasantness.",2016,2021-04-19T15:57:20Z,2021-04-19T15:57:20Z,,31-36,6,,,,,,,,,,IEEE,"345 E 47TH ST, NEW YORK, NY 10017 USA",English,,,,,,,Backup Publisher: Brazilian Comp Soc; Centro Estudos Sistemas Avancados Recife; Centro Informatica UFPE; ROBOLIURE; VIRTUS IMPAVIDA; Inst Inovacao; Robolivre; CAPES; Inst SENAI Inovacao; Conselho Nacl Desenvolvimento Cientifico Tecnologico; Fundacao Amparo Ciencia Tecnologia Estado Pernambuco; IEEE Robot & Automat Soc Chapter Brazil; IEEE Latin Amer Robot Council Type: Proceedings Paper,"<p>13th Latin American Robotics Symposium / 4th Brazilian Robotics Symposium (LARS/SBR), Recife, BRAZIL, OCT 08-12, 2016</p>",,,,,"Cavalcante, SV and Tonidandel, F",,,,,,,,,,,,,,,,,,,,,,,,,,,,,,,,,,,,,,,,,,,,,,anemotionbasedinteractionstrategytoimprovehumanrobotinteraction,an emotionbased interaction strategy to improve humanrobot interaction emotion and empathy are key subjects on humanrobot interaction especially regarding social robots several studies have investigated emotional reactions of humans toward robots while others deal with development of actual systems to analyze how affective feedback may influence this kind of interaction this paper presents an emotionaware interaction strategy applied to an embodied virtual agent implemented as an android application the system assigns two distinct paradigms to the virtual character according to the users emotion inferred through facial expressions analysis within subject user experiments have been performed in order to evaluate if the proposed strategy improves empathy and pleasantness
Empathic Interaction using the Computational Emotion Model,5,"Rasool, Zeeshan; Masuyama, Naoki; Islam, Md. Nazrul; Loo, Chu Kiong",2015 IEEE SYMPOSIUM SERIES ON COMPUTATIONAL IN℡LIGENCE (IEEE SSCI),2015,conferencePaper,978-1-4799-7560-0,,10.1109/SSCI.2015.26,,"This paper describes the empathy oriented human-robot interaction model. It is projected to design the model capable of different empathic responses (parallel and reactive) during the course of interaction with the user, depending upon the personality and mood factors of the robot. The proposed model encompasses three main stages i.e., perception, empathic appraisal and empathic expression. Perception refers to capturing user's emotion state via facial expression recognition. Empathic appraisal is based on the computational emotional model for generating its internal emotions, mood state and empathic responses. The internal emotions are defined using psychological studies and generated on 2D (pleasure-arousal) scaling model; whereas, fuzzy logic is used to calculate the intensity of the each emotion. A virtual facial expression simulator is applied for expression of resultant empathic emotions. Preliminary experimental results show that the proposed model is capable of exhibiting different empathic responses with respect to the personality and mood factors.",2015,2021-04-19T15:57:37Z,2021-04-19T15:57:37Z,,109-116,8,,,,,,,,,,IEEE,"345 E 47TH ST, NEW YORK, NY 10017 USA",English,,,,,,,Backup Publisher: IEEE; IEEE Computational Intelligence Soc; IEEE BigData Type: Proceedings Paper,"<p>IEEE Symposium Series Computational Intelligence, Cape Town, SOUTH AFRICA, DEC 07-10, 2015</p>",,,,,,,,,,,,,,,,,,,,,,,,,,,,,,,,,,,,,,,,,,,,,,,,,,,empathicinteractionusingthecomputationalemotionmodel,empathic interaction using the computational emotion model this paper describes the empathy oriented humanrobot interaction model it is projected to design the model capable of different empathic responses parallel and reactive during the course of interaction with the user depending upon the personality and mood factors of the robot the proposed model encompasses three main stages ie perception empathic appraisal and empathic expression perception refers to capturing users emotion state via facial expression recognition empathic appraisal is based on the computational emotional model for generating its internal emotions mood state and empathic responses the internal emotions are defined using psychological studies and generated on 2d pleasurearousal scaling model whereas fuzzy logic is used to calculate the intensity of the each emotion a virtual facial expression simulator is applied for expression of resultant empathic emotions preliminary experimental results show that the proposed model is capable of exhibiting different empathic responses with respect to the personality and mood factors
Development of a Cloud-based Computational Framework for an Empathetic Robot,1,"Salaken, Syed Moshfeq; Nahavandi, Saeid; McGinn, Conor; Hossny, Mohammed; Kelly, Kevin; Abobakr, Ahmed; Nahavandi, Darius; Iskander, Julie",PROCEEDINGS OF 2019 11TH INTERNATIONAL CONFERENCE ON COMPUTER AND AUTOMATION ENGINEERING (ICCAE 2019),2019,conferencePaper,978-1-4503-6287-0,,10.1145/3313991.3314018,,"This article presents the development and preliminary evaluation of an empathy controlled robot. Such a robot is one step forward towards industry 5.0, as it provides a theoretical framework to enable the performance of the robot to be customized to suit the needs of both the task as well as the operator. An inventive step is taken through the separation of computational resources based on whether the algorithms are addressing functional or experiential needs. The paper therefore addresses the requirement for new approaches that can be employed in the design of mobile robots to reduce cost, power consumption, and computational burden of the system. We propose that tasks requiring real-time and safety critical control are processed using dedicated on-board computers, whereas functionality dedicated to system optimization, machine learning and customization are handled through use a cloud-based platform. In this paper, key components of the architecture are defined, and the development and preliminary evaluation of an exemplar robot capable of changing its behavior in accordance with the perceived emotional state of an operator's voice is presented.",2019,2021-04-19T15:56:34Z,2021-04-19T15:56:34Z,,102-108,7,,,,,,International Conference on Computer and Automation Engineering,,,,ASSOC COMPUTING MACHINERY,"1515 BROADWAY, NEW YORK, NY 10036-9998 USA",English,,,,,,,ISSN: 2154-4352 Type: Proceedings Paper,"<p>11th International Conference on Computer and Automation Engineering (ICCAE), Perth, AUSTRALIA, FEB 23-25, 2019</p>",,,,cloud control; deep learning; emotion classification; intent perception; robot,,,,,,,,,,,,,,,,,,,,,,,,,,,,,,,,,,,,,,,,,,,,,,,developmentofacloudbasedcomputationalframeworkforanempatheticrobot,development of a cloudbased computational framework for an empathetic robot this article presents the development and preliminary evaluation of an empathy controlled robot such a robot is one step forward towards industry 50 as it provides a theoretical framework to enable the performance of the robot to be customized to suit the needs of both the task as well as the operator an inventive step is taken through the separation of computational resources based on whether the algorithms are addressing functional or experiential needs the paper therefore addresses the requirement for new approaches that can be employed in the design of mobile robots to reduce cost power consumption and computational burden of the system we propose that tasks requiring realtime and safety critical control are processed using dedicated onboard computers whereas functionality dedicated to system optimization machine learning and customization are handled through use a cloudbased platform in this paper key components of the architecture are defined and the development and preliminary evaluation of an exemplar robot capable of changing its behavior in accordance with the perceived emotional state of an operators voice is presented
