Title,Citations,Author,Publication Title,Publication Year,Item Type,ISBN,ISSN,DOI,Url,Abstract Note,Date,Date Added,Date Modified,Access Date,Pages,Num Pages,Issue,Volume,Number Of Volumes,Journal Abbreviation,Short Title,Series,Series Number,Series Text,Series Title,Publisher,Place,Language,Rights,Type,Archive,Archive Location,Library Catalog,Call Number,Extra,Notes,File Attachments,Link Attachments,Manual Tags,Automatic Tags,Editor,Series Editor,Translator,Contributor,Attorney Agent,Book Author,Cast Member,Commenter,Composer,Cosponsor,Counsel,Interviewer,Producer,Recipient,Reviewed Author,Scriptwriter,Words By,Guest,Number,Edition,Running Time,Scale,Medium,Artwork Size,Filing Date,Application Number,Assignee,Issuing Authority,Country,Meeting Name,Conference Name,Court,References,Reporter,Legal Status,Priority Numbers,Programming Language,Version,System,Code,Code Number,Section,Session,Committee,History,Legislative Body,Title Duplicate,TA Keyword
Fake Empathy and Human-Robot Interaction (HRI): A Preliminary Study,6,"Vallverdu, Jordi; Nishida, Toyoaki; Ohmoto, Yoshisama; Moran, Stuart; Lazare, Sarah",INTERNATIONAL JOURNAL OF TECHNOLOGY AND HUMAN INTERACTION,2018,journalArticle,,1548-3908,10.4018/IJTHI.2018010103,,"Empathy is a basic emotion trigger for human beings, especially while regulating social relationships and behaviour. The main challenge of this paper is study whether people's empathic reactions towards robots change depending on previous information given to human about the robot before the interaction. The use of false data about robot skills creates different levels of what we call `fake empathy'. This study performs an experiment in WOZ environment in which different subjects (n=17) interacting with the same robot while they believe that the robot is a different robot, up to three versions. Each robot scenario provides a different `humanoid' description, and out hypothesis is that the more human-like looks the robot, the more empathically can be the human responses. Results were obtained from questionnaires and multi-angle video recordings. Positive results reinforce the strength of our hypothesis, although we recommend a new and bigger and then more robust experiment.",2018-03,2021-04-19T15:56:58Z,2021-04-19T15:56:58Z,,44-59,16,1,14,,,,,,,,,,English,,,,,,,"Place: 701 E CHOCOLATE AVE, STE 200, HERSHEY, PA 17033-1240 USA Publisher: IGI GLOBAL Type: Article",,,,,Emotions; Empathy; Fake; HRI; Human-Robot Interaction; Robots; WOZ,,,,,,,,,,,,,,,,,,,,,,,,,,,,,,,,,,,,,,,,,,,,,,,fakeempathyandhumanrobotinteractionhriapreliminarystudy,fake empathy and humanrobot interaction hri a preliminary study empathy is a basic emotion trigger for human beings especially while regulating social relationships and behaviour the main challenge of this paper is study whether peoples empathic reactions towards robots change depending on previous information given to human about the robot before the interaction the use of false data about robot skills creates different levels of what we call fake empathy this study performs an experiment in woz environment in which different subjects n17 interacting with the same robot while they believe that the robot is a different robot up to three versions each robot scenario provides a different humanoid description and out hypothesis is that the more humanlike looks the robot the more empathically can be the human responses results were obtained from questionnaires and multiangle video recordings positive results reinforce the strength of our hypothesis although we recommend a new and bigger and then more robust experiment
Embodiment into a robot increases its acceptability,9,"Ventre-Dominey, J.; Gibert, G.; Bosse-Platiere, M.; Farne, A.; Dominey, P. F.; Pavani, F.",SCIENTIFIC REPORTS,2019,journalArticle,,2045-2322,10.1038/s41598-019-46528-7,,"Recent studies have shown how embodiment induced by multisensory bodily interactions between individuals can positively change social attitudes (closeness, empathy, racial biases). Here we use a simple neuroscience-inspired procedure to beam our human subjects into one of two distinct robots and demonstrate how this can readily increase acceptability and social closeness to that robot. Participants wore a Head Mounted Display tracking their head movements and displaying the 3D visual scene taken from the eyes of a robot which was positioned in front of a mirror and piloted by the subjects' head movements. As a result, participants saw themselves as a robot. When participant' and robot's head movements were correlated, participants felt that they were incorporated into the robot with a sense of agency. Critically, the robot they embodied was judged more likeable and socially closer. Remarkably, we found that the beaming experience with correlated head movements and corresponding sensation of embodiment and social proximity, was independent of robots' humanoid's appearance. These findings not only reveal the ease of body-swapping, via visual-motor synchrony, into robots that do not share any clear human resemblance, but they may also pave a new way to make our future robotic helpers socially acceptable.",2019-07-12,2021-04-19T15:56:20Z,2021-04-19T15:56:20Z,,,,,9,,,,,,,,,,English,,,,,,,"Place: MACMILLAN BUILDING, 4 CRINAN ST, LONDON N1 9XW, ENGLAND Publisher: NATURE PUBLISHING GROUP Type: Article",,,,,,,,,,,,,,,,,,,,,,,,,,,,,,,,,,,,,,,,,,,,,,,,,,,,embodimentintoarobotincreasesitsacceptability,embodiment into a robot increases its acceptability recent studies have shown how embodiment induced by multisensory bodily interactions between individuals can positively change social attitudes closeness empathy racial biases here we use a simple neuroscienceinspired procedure to beam our human subjects into one of two distinct robots and demonstrate how this can readily increase acceptability and social closeness to that robot participants wore a head mounted display tracking their head movements and displaying the 3d visual scene taken from the eyes of a robot which was positioned in front of a mirror and piloted by the subjects head movements as a result participants saw themselves as a robot when participant and robots head movements were correlated participants felt that they were incorporated into the robot with a sense of agency critically the robot they embodied was judged more likeable and socially closer remarkably we found that the beaming experience with correlated head movements and corresponding sensation of embodiment and social proximity was independent of robots humanoids appearance these findings not only reveal the ease of bodyswapping via visualmotor synchrony into robots that do not share any clear human resemblance but they may also pave a new way to make our future robotic helpers socially acceptable
Emotional Empathy Model for Robot Partners Using Recurrent Spiking Neural Network Model with Hebbian-LMS Learning,12,"Woo, Jinseok; Botzheim, Janos; Kubota, Naoyuki",MALAYSIAN JOURNAL OF COMPUTER SCIENCE,2017,journalArticle,,0127-9084,10.22452/mjcs.vol30no4.1,,"This paper discusses the development of an emotion model for robot partner system. In our previous studies, we have focused only on the robot's emotional state. However, the emotional state of the other party is also an important factor for smooth conversation in human society. Therefore, the robot partner has two emotional structures for human: empathy and robot emotion. First, human empathy uses a perceptual based emotion model to know the human's emotional state based on the sensory information. Next, we propose a recurrent simple spike response model to improve the robot's emotional model, and we apply “Hebbian-LMS” learning to modify the weights in the spiking neural network. The robot's emotional state is calculated by using the human's emotional information, internal and external information. The robot partner can use the emotional results to control the facial and gesture expression. The utterance style is also changed by the robot's emotional state. As a result, the robot partner can interact emotionally and naturally with human. First, we explain the related works and the development of the robot partner “iPhonoid-C”. Next, we define the architecture of the emotional model to realize emotional empathy towards human. Then, we discuss the algorithms and the methods for developing the emotional model. Finally, we show experimental results of the proposed method, and discuss the effectiveness of the proposed structure.",2017,2021-04-19T15:57:07Z,2021-04-19T15:57:07Z,,258-285,28,4,30,,,,,,,,,,English,,,,,,,"Place: UNIV MALAYA, FAC COMPUTER SCIENCE & INFORMATION TECH, KUALA LUMPUR, 50603, MALAYSIA Publisher: UNIV MALAYA, FAC COMPUTER SCIENCE & INFORMATION TECH Type: Article",,,,,Conversation System; Emotional Empathy Model; Hebbian-LMS Learning; Recurrent Spiking Neural Network; Robot Partner,,,,,,,,,,,,,,,,,,,,,,,,,,,,,,,,,,,,,,,,,,,,,,,emotionalempathymodelforrobotpartnersusingrecurrentspikingneuralnetworkmodelwithhebbianlmslearning,emotional empathy model for robot partners using recurrent spiking neural network model with hebbianlms learning this paper discusses the development of an emotion model for robot partner system in our previous studies we have focused only on the robots emotional state however the emotional state of the other party is also an important factor for smooth conversation in human society therefore the robot partner has two emotional structures for human empathy and robot emotion first human empathy uses a perceptual based emotion model to know the humans emotional state based on the sensory information next we propose a recurrent simple spike response model to improve the robots emotional model and we apply hebbianlms learning to modify the weights in the spiking neural network the robots emotional state is calculated by using the humans emotional information internal and external information the robot partner can use the emotional results to control the facial and gesture expression the utterance style is also changed by the robots emotional state as a result the robot partner can interact emotionally and naturally with human first we explain the related works and the development of the robot partner iphonoidc next we define the architecture of the emotional model to realize emotional empathy towards human then we discuss the algorithms and the methods for developing the emotional model finally we show experimental results of the proposed method and discuss the effectiveness of the proposed structure
A computational model of empathy for interactive agents,18,"Yalcin, Ozge Nilay; DiPaola, Steve",BIOLOGICALLY INSPIRED COGNITIVE ARCHITECTURES,2018,journalArticle,,2212-683X,10.1016/j.bica.2018.07.010,,"Empathy has been defined in the scientific literature as the capacity to relate another's emotional state and assigned to a broad spectrum of cognitive and behavioral abilities. Advances in neuroscience, psychology and ethology made it possible to refine the defined functions of empathy to reach a working definition and a model of empathy. Recently, cognitive science and artificial intelligence communities made attempts to model empathy in artificial agents, which can provide means to test these models and hypotheses. A computational model of empathy not only would help to advance the technological artifacts to be more socially compatible, but also understand the empathy mechanisms, test theories, and address the ethics and morality problems the Artificial Intelligence (AI) community is facing today. In this paper, we will review the empathy research from various fields, gather the requirements for empathic capacity and construct a model of empathy that is suitable for interactive conversational agents.",2018-10,2021-04-19T15:56:42Z,2021-04-19T15:56:42Z,,20-25,6,,26,,,,,,,,,,English,,,,,,,"Place: PO BOX 211, 1000 AE AMSTERDAM, NETHERLANDS Publisher: ELSEVIER SCIENCE BV Type: Article",,,,,Affective computing; Conversational agents; Empathy,,,,,,,,,,,,,,,,,,,,,,,,,,,,,,,,,,,,,,,,,,,,,,,acomputationalmodelofempathyforinteractiveagents,a computational model of empathy for interactive agents empathy has been defined in the scientific literature as the capacity to relate anothers emotional state and assigned to a broad spectrum of cognitive and behavioral abilities advances in neuroscience psychology and ethology made it possible to refine the defined functions of empathy to reach a working definition and a model of empathy recently cognitive science and artificial intelligence communities made attempts to model empathy in artificial agents which can provide means to test these models and hypotheses a computational model of empathy not only would help to advance the technological artifacts to be more socially compatible but also understand the empathy mechanisms test theories and address the ethics and morality problems the artificial intelligence ai community is facing today in this paper we will review the empathy research from various fields gather the requirements for empathic capacity and construct a model of empathy that is suitable for interactive conversational agents
Teach your robot how you want it to express emotions: On the personalized affective human-humanoid interaction,0,"Virčíkova, M.; Sinčák, P.",Advances in Intelligent Systems and Computing,2015,bookChapter,,21945357,10.1007/978-3-319-10783-7_9,https://www.scopus.com/inward/record.uri?eid=2-s2.0-85032118207&doi=10.1007%2f978-3-319-10783-7_9&partnerID=40&md5=22af8b608d901d438a4c1910a06c47ef,"We believe that in order for robots to interact naturally with humans, they should be able to express affective behavior. This paper deals with the development of an affective model for social robotics in which the resulting robotic expressions adapt according to the human subjective preferences. We have developed a method which can be used by non-technical individuals to design the affective models of humanoid robots. Our vision of the future research is that the proposed personalization will be treated, from user’s perspective, as an empathic response of the machine. We see the major contribution of this unique approach especially in long-term human-robot relationships and it could ultimately lead to robots being accepted in a wider domain. © Springer International Publishing Switzerland 2015.",2015,2021-05-19T13:26:44Z,2021-05-19T13:26:44Z,,81-92,12,,316,,,,,,,,,,English,,,,,,,Publisher: Springer Verlag,<p>cited By 0</p>,,,Affective behaviors; Affective model; Anthropomorphic robots; Computer vision; Economic and social effects; Express emotions; Human robot interaction; Human robots; Humanoid interaction; Humanoid robot; Machine design; Personalizations; Robotics; Robots; Social robotics,,,,,,,,,,,,,,,,,,,,,,,,,,,,,,,,,,,,,,,,,,,,,,,,,
Increasing Engagement with Chameleon Robots in Bartending Services,0,"Rossi, Silvia; Dell'Aquila, Elena; Russo, Davide; Maggi, Gianpaolo",2020 29TH IEEE INTERNATIONAL CONFERENCE ON ROBOT AND HUMAN INTERACTIVE COMMUNICATION (RO-MAN),2020,conferencePaper,978-1-72816-075-7,,10.1109/RO-MAN47096.2020.9223488,,"As the field of service robotics has been rapidly growing, it is expected for such robots to be endowed with the appropriate capabilities to interact with humans in a socially acceptable way. This is particularly relevant in the case of customer relationships where a positive and affective interaction has an impact on the users' experience. In this paper, we address the question of whether a specific behavioral style of a barman-robot, acted through para-verbal and non-verbal behaviors, can affect users' engagement and the creation of positive emotions. To that end, we endowed a barman-robot taking drink orders from human customers, with an empathic behavioral style. This aims at triggering to alignment process by mimicking the conversation partner's behavior. This behavioral style is compared to an entertaining style, aiming at creating a positive relationship with the users, and a neutral style for control. Results suggest that when participants experienced more positive emotions, the robot was perceived as safer, so suggesting that interactions that stimulate positive and open relations with the robot may have a positive impact on the affective dimension of engagement. Indeed, when the empathic robot modulates its behavior according to the user's one, this interaction seems to be more effective than when interacting with a neutral robot in improving engagement and positive emotions in public-service contexts.",2020,2021-05-19T13:30:12Z,2021-05-19T13:30:12Z,,464-469,6,,,,,,IEEE RO-MAN,,,,IEEE,"345 E 47TH ST, NEW YORK, NY 10017 USA",English,,,,,,,Backup Publisher: IEEE; IEEE Robot & Automat Soc; Robot Soc Japan; Korean Robot Soc; Furhat Robot; EurAi; Assoc Italiana Lingusitica Computazionale; Assoc Italiana Scienze Voce; Springer; Robotics ISSN: 1944-9445 Type: Proceedings Paper,"<p>29th IEEE International Conference on Robot and Human Interactive Communication (IEEE RO-MAN), ELECTR NETWORK, AUG 31-SEP 04, 2020</p>",,,,,,,,,,,,,,,,,,,,,,,,,,,,,,,,,,,,,,,,,,,,,,,,,,,,
New Trend on ASD: Can Social Robot Be a Useful Tool in Joint Attention for ASD?,0,"Sani-Bozkurt, Sunagul; Bozkus-Genc, Gulden","14TH INTERNATIONAL TECHNOLOGY, EDUCATION AND DEVELOPMENT CONFERENCE (INTED2020)",2020,conferencePaper,978-84-09-17939-8,,,,"Children with Autism Spectrum Disorder (ASD) suffer from a characteristic impairment in the ability to interpret social cues and often fail to use social gaze in empathetic and joint-attention tasks. The behavior of tracking an adult's eye movements, which appears in typically developing children in about 6th month, is considered as the beginning point of the ability to respond to joint attention. Studies show that children with ASD exhibit less joint attention skill and they fail in looking at the direction others are looking at and pointing at and in following the direction others are looking at, pointing at when they are compared to typically developing children and other children with developmental retardation. It is reported in some studies that the behaviors of responding to others' joint attention and initiation to joint attention are taught separately, and in other studies, both joint attention abilities are taught together. Nowadays, robot applications have appeared as a new approach in ASD implementations as a result of technological and scientific developments. Various social robots have been produced with an aim to increase the motivation of those with ASD by decreasing the stress level in complicated situations in the social setting and by enabling them to learn in simpler, predictable, and controlled settings. Besides, recently, social robots have increasingly been used in teaching joint attention abilities. In this study, it was aimed to give information about joint attention and types of robots, explain the characteristics of social robots, and put forward the current trends related to social robots by examining the studies conducted on the use of social robots for teaching joint attention abilities to children with ASD. Social robots could be a promising method for ASD treatment. There are remarkably different results regarding the robot applications in teaching the joint attention abilities to children with ASD. Therefore, it is not definitively known to which extent robot therapy contributes to the student's joint attention improvement. While efficiency research is frequently conducted in the studies in which robots have been used for teaching joint attention abilities to children with ASD, although rarely, comparative studies have also been conducted in recent years. Positive results are mentioned in this efficiency research, whereas there are also controversial results. In comparative studies, it is noteworthy that the human being and robot applications were compared in only one study. As a result, robots are thought to provide a significant support for the development of joint attention interactions such as attracting the attention of children, helping them participate in activities, building a bond for social interaction, motivating them, providing natural stimuli and bringing about different emotional expressions although there are different results about robot applications in the development of the joint attention abilities of children with ASD. In the related literature, it is also suggested to work with larger and different sample groups in order to generalize the existing study results since it is observed that the dimension of generalization is not addressed. Further studies in which robots play an active role compared to therapists can be carried out.",2020,2021-05-19T13:30:16Z,2021-05-19T13:30:16Z,,2090-2097,8,,,,,,INTED Proceedings,,,,IATED-INT ASSOC TECHNOLOGY EDUCATION & DEVELOPMENT,"LAURI VOLPI 6, VALENICA, BURJASSOT 46100, SPAIN",English,,,,,,,ISSN: 2340-1079 Type: Proceedings Paper,"<p>14th International Technology, Education and Development Conference (INTED), Valencia, SPAIN, MAR 02-04, 2020</p>",,,,Autism spectrum disorder; joint attention; robots; social robot,"Chova, LG and Martinez, AL and Torres, IC",,,,,,,,,,,,,,,,,,,,,,,,,,,,,,,,,,,,,,,,,,,,,,,
Towards Metrics of Evaluation of Pepper Robot as a Social Companion for the Elderly,15,"Bechade, Lucile; Dubuisson-Duplessis, Guillaume; Pittaro, Gabrielle; Garcia, Melanie; Devillers, Laurence",ADVANCED SOCIAL INTERACTION WITH AGENTS,2019,conferencePaper,978-3-319-92108-2 978-3-319-92107-5,,10.1007/978-3-319-92108-2_11,,"For the design of socially acceptable robots, field studies in Human-Robot Interaction are necessary. Constructing dialogue benchmarks can have a meaning only if researchers take into account the evaluation of robot, human, and their interaction. This paper describes a study aiming at finding an objective evaluation procedure of the dialogue with a social robot. The goal is to build an empathic robot (JOKER project) and it focuses on elderly people, the end-users expected by ROMEO2 project. The authors carried out three experimental sessions. The first time, the robot was NAO, and it was with a Wizard of Oz (emotions were entered manually by experimenters as inputs to the program). The other times, the robot was Pepper, and it was totally autonomous (automatic detection of emotions and decision according to). Each interaction involved various scenarios dealing with emotion recognition, humor, negotiation and cultural quiz. The paper details the system functioning, the scenarios and the evaluation of the experiments.",2019,2021-05-19T13:30:29Z,2021-05-19T13:30:29Z,,89-101,13,,510,,,,Lecture Notes in Electrical Engineering,,,,SPRINGER INTERNATIONAL PUBLISHING AG,"GEWERBESTRASSE 11, CHAM, CH-6330, SWITZERLAND",English,,,,,,,ISSN: 1876-1100 Type: Proceedings Paper,"<p>8th International Workshop on Spoken Dialogue Systems (IWSDS), Farmington, PA, JUN 06-09, 2017</p>",,,,Data collection; Elderly end-users; Evaluation; Human-Robot Interaction; Metrics,"Eskenazi, M and Devillers, L and Mariani, J",,,,,,,,,,,,,,,,,,,,,,,,,,,,,,,,,,,,,,,,,,,,,,,
Towards a Multimodal Time-Based Empathy Prediction System,1,"Barbieri, Francesco; Guizzo, Eric; Lucchesi, Federico; Maffei, Giovanni; del Prado Martin, Fermin Moscoso; Weyde, Tillman",2019 14TH IEEE INTERNATIONAL CONFERENCE ON AUTOMATIC FACE AND GESTURE RECOGNITION (FG 2019),2019,conferencePaper,978-1-72810-089-0,,10.1109/FG.2019.8756532,,We describe our system for empathic emotion recognition. It is based on deep learning on multiple modalities in a late fusion architecture. We describe the modules of our system and discuss the evaluation results. Our code is also available for the research community(1),2019,2021-05-19T13:30:34Z,2021-05-19T13:30:34Z,,716-720,5,,,,,,IEEE International Conference on Automatic Face and Gesture Recognition and Workshops,,,,IEEE,"345 E 47TH ST, NEW YORK, NY 10017 USA",English,,,,,,,"Backup Publisher: IEEE; Univ Lille; Inst Mines Telecom; Univ Lille, Inst Mines Telecom, Ecole Mines Telecom, IMT Lille Douai; INRIA; 3DMD; Google; I Site Univ Lille Nord Europe; Centre Rech Informatique Signal Automatique Lille; IEEE Comp Soc; IEEE Biometr Council ISSN: 2326-5396 Type: Proceedings Paper","<p>14th IEEE International Conference on Automatic Face and Gesture Recognition (FG), Lille, FRANCE, MAY 14-18, 2019</p>",,,,,,,,,,,,,,,,,,,,,,,,,,,,,,,,,,,,,,,,,,,,,,,,,,,,
