Title,Citations,Author,Publication Title,Publication Year,Item Type,ISBN,ISSN,DOI,Url,Abstract Note,Date,Date Added,Date Modified,Access Date,Pages,Num Pages,Issue,Volume,Number Of Volumes,Journal Abbreviation,Short Title,Series,Series Number,Series Text,Series Title,Publisher,Place,Language,Rights,Type,Archive,Archive Location,Library Catalog,Call Number,Extra,Notes,File Attachments,Link Attachments,Manual Tags,Automatic Tags,Editor,Series Editor,Translator,Contributor,Attorney Agent,Book Author,Cast Member,Commenter,Composer,Cosponsor,Counsel,Interviewer,Producer,Recipient,Reviewed Author,Scriptwriter,Words By,Guest,Number,Edition,Running Time,Scale,Medium,Artwork Size,Filing Date,Application Number,Assignee,Issuing Authority,Country,Meeting Name,Conference Name,Court,References,Reporter,Legal Status,Priority Numbers,Programming Language,Version,System,Code,Code Number,Section,Session,Committee,History,Legislative Body,Title Duplicate,TA Keyword
Consciousnes-based emotion and behavior of pet robot with brain-inspired method,0,"Chumkamon, S.; Hayashi, E.",Information (Japan),2017,journalArticle,,13434500,,https://www.scopus.com/inward/record.uri?eid=2-s2.0-85033411589&partnerID=40&md5=153492716af71f45b6e7fbfbed28a1e1,"A personal robot becomes important to the future world where the robot facilitates our lives and be a friend. The understanding of emotional interaction is essential in the social behavior, including a natural behavior that is the needed functions for creature behavior-like robots. Our paper proposes the artificial topological consciousness based on a pet robot using a synthetic neurotransmitter and motivation including intelligent emotion. Since the significant factor of a companionable robot is the cross-communication system without conflict. This paper then focuses on three points: The first is the organization of the behavior and emotion model regarding the phylogenetic. The second, the method of the robot that can have empathy with user expression. The third, how the robot can perform the expression to the human with emotional intelligence us-ing a biologically inspired topological on-line method for encouragement or being delighted. We additionally demonstrate the performance of the artificial consciousness based on complexity level and the robot social expression to enhance the users affinity with the experiment. © 2017 International Information Institute.",2017,2021-04-20T16:38:49Z,2021-04-20T16:38:49Z,,615-629,15,1,20,,,,,,,,,,English,,,,,,,Publisher: International Information Institute Ltd.,<p>cited By 0</p>,,,,,,,,,,,,,,,,,,,,,,,,,,,,,,,,,,,,,,,,,,,,,,,,,,,consciousnesbasedemotionandbehaviorofpetrobotwithbraininspiredmethod,consciousnesbased emotion and behavior of pet robot with braininspired method a personal robot becomes important to the future world where the robot facilitates our lives and be a friend the understanding of emotional interaction is essential in the social behavior including a natural behavior that is the needed functions for creature behaviorlike robots our paper proposes the artificial topological consciousness based on a pet robot using a synthetic neurotransmitter and motivation including intelligent emotion since the significant factor of a companionable robot is the crosscommunication system without conflict this paper then focuses on three points the first is the organization of the behavior and emotion model regarding the phylogenetic the second the method of the robot that can have empathy with user expression the third how the robot can perform the expression to the human with emotional intelligence using a biologically inspired topological online method for encouragement or being delighted we additionally demonstrate the performance of the artificial consciousness based on complexity level and the robot social expression to enhance the users affinity with the experiment  2017 international information institute
Intelligent emotion and behavior based on topological consciousness and adaptive resonance theory in a companion robot,14,"Chumkamon, Sakmongkon; Hayashi, Eiji; Masato, Koike",BIOLOGICALLY INSPIRED COGNITIVE ARCHITECTURES,2016,journalArticle,,2212-683X,10.1016/j.bica.2016.09.004,,"Companion or `pet' robots can be expected to be an important part of a future in which robots contribute to our lives in many ways. An understanding of emotional interactions would be essential to such robots' behavior. To improve the cognitive and behavior systems of such robots, we propose the use of an artificial topological consciousness that uses a synthetic neurotransmitter and motivation, including a biologically inspired emotion system. A fundamental aspect of a companion robot is a cross communication system that enables natural interactions between humans and the robot. This paper focuses on three points in the development of our proposed framework: (1) the organization of the behavior including inside-state emotion regarding the phylogenetic consciousness-based architecture; (2) a method whereby the robot can have empathy toward its human user's expressions of emotion; and (3) a method that enables the robot to select a facial expression in response to the human user, providing instant human-like `emotion' and based on emotional intelligence (El) that uses a biologically inspired topological online method to express, for example, encouragement or being delighted. We also demonstrate the performance of the artificial consciousness based on the complexity level and a robot's social expressions that are designed to enhance the users affinity with the robot. (C) 2016 Elsevier B.V. All rights reserved.",2016-10,2021-04-19T15:57:14Z,2021-04-19T15:57:14Z,,51-67,17,,18,,,,,,,,,,English,,,,,,,"Place: PO BOX 211, 1000 AE AMSTERDAM, NETHERLANDS Publisher: ELSEVIER SCIENCE BV Type: Article",,,,,Behavior; Companion robot; Consciousness based architecture; Emotional intelligence; Human-robot interaction,,,,,,,,,,,,,,,,,,,,,,,,,,,,,,,,,,,,,,,,,,,,,,,intelligentemotionandbehaviorbasedontopologicalconsciousnessandadaptiveresonancetheoryinacompanionrobot,intelligent emotion and behavior based on topological consciousness and adaptive resonance theory in a companion robot companion or pet robots can be expected to be an important part of a future in which robots contribute to our lives in many ways an understanding of emotional interactions would be essential to such robots behavior to improve the cognitive and behavior systems of such robots we propose the use of an artificial topological consciousness that uses a synthetic neurotransmitter and motivation including a biologically inspired emotion system a fundamental aspect of a companion robot is a cross communication system that enables natural interactions between humans and the robot this paper focuses on three points in the development of our proposed framework 1 the organization of the behavior including insidestate emotion regarding the phylogenetic consciousnessbased architecture 2 a method whereby the robot can have empathy toward its human users expressions of emotion and 3 a method that enables the robot to select a facial expression in response to the human user providing instant humanlike emotion and based on emotional intelligence el that uses a biologically inspired topological online method to express for example encouragement or being delighted we also demonstrate the performance of the artificial consciousness based on the complexity level and a robots social expressions that are designed to enhance the users affinity with the robot c 2016 elsevier bv all rights reserved
Gesture design attribute and level value of social robot: A user experience based study,,"Chung, S.-E.; Ryoo, H.-Y.",Journal of System and Management Sciences,2020,journalArticle,,18166075,,https://www.scopus.com/inward/record.uri?eid=2-s2.0-85090517849&partnerID=40&md5=061cc8cf686359b56d6cd0e6709071a3,"This study was to verify the attributes of the social robot's gesture design factors that has a significant difference in the user experience and to establish the level values of the attributes. To do so, the attributes and the level value standards for the gesture interface's key design factors have been organized and a user experience survey was conducted through researches on the existing literature and case studies. For the emotional gesture attributes, the level values were categorized as 'pleasure at low arousal', 'pleasure at high arousal', 'displeasure at low arousal', and 'displeasure at high arousal'. Among the communicative expression gesture attributes, the level values were categorized as ‘idling, conversation induction and concentration, and empathy’. Lastly, the derived attributes and the level values for the ‘emotional gesture’ and ‘communicative gesture’ have been integrated with the ones for the ‘functional/semantic gesture' derived on the previous studies; they have been presented as the robot's gesture interface design factors available in the aspect of the user experience. © 2020, Success Culture Press. All rights reserved.",2020,2021-04-20T16:38:36Z,2021-04-20T16:38:36Z,,108-121,14,2,10,,,,,,,,,,English,,,,,,,Publisher: Success Culture Press,<p>cited By 0</p>,,,,,,,,,,,,,,,,,,,,,,,,,,,,,,,,,,,,,,,,,,,,,,,,,,,gesturedesignattributeandlevelvalueofsocialrobotauserexperiencebasedstudy,gesture design attribute and level value of social robot a user experience based study this study was to verify the attributes of the social robots gesture design factors that has a significant difference in the user experience and to establish the level values of the attributes to do so the attributes and the level value standards for the gesture interfaces key design factors have been organized and a user experience survey was conducted through researches on the existing literature and case studies for the emotional gesture attributes the level values were categorized as pleasure at low arousal pleasure at high arousal displeasure at low arousal and displeasure at high arousal among the communicative expression gesture attributes the level values were categorized as idling conversation induction and concentration and empathy lastly the derived attributes and the level values for the emotional gesture and communicative gesture have been integrated with the ones for the functionalsemantic gesture derived on the previous studies they have been presented as the robots gesture interface design factors available in the aspect of the user experience  2020 success culture press all rights reserved
A neurocognitive investigation of the impact of socializing with a robot on empathy for pain,20,"Cross, Emily S.; Riddoch, Katie A.; Pratts, Jaydan; Titone, Simon; Chaudhury, Bishakha; Hortensius, Ruud",PHILOSOPHICAL TRANSACTIONS OF THE ROYAL SOCIETY B-BIOLOGICAL SCIENCES,2019,journalArticle,,0962-8436,10.1098/rstb.2018.0034,,"To what extent can humans form social relationships with robots? In the present study, we combined functional neuroimaging with a robot socializing intervention to probe the flexibility of empathy, a core component of social relationships, towards robots. Twenty-six individuals underwent identical fMRI sessions before and after being issued a social robot to take home and interact with over the course of a week. While undergoing fMRI, participants observed videos of a human actor or a robot experiencing pain or pleasure in response to electrical stimulation. Repetition suppression of activity in the pain network, a collection of brain regions associated with empathy and emotional responding, was measured to test whether socializing with a social robot leads to greater overlap in neural mechanisms when observing human and robotic agents experiencing pain or pleasure. In contrast to our hypothesis, functional region-of-interest analyses revealed no change in neural overlap for agents after the socializing intervention. Similarly, no increase in activation when observing a robot experiencing pain emerged post-socializing. Whole-brain analysis showed that, before the socializing intervention, superior parietal and early visual regions are sensitive to novel agents, while after socializing, medial temporal regions show agent sensitivity. A region of the inferior parietal lobule was sensitive to novel emotions, but only during the pre-socializing scan session. Together, these findings suggest that a short socialization intervention with a social robot does not lead to discernible differences in empathy towards the robot, as measured by behavioural or brain responses. We discuss the extent to which long-term socialization with robots might shape social cognitive processes and ultimately our relationships with these machines. This article is part of the theme issue `From social brains to social robots: applying neurocognitive insights to human-robot interaction'.",2019-04-29,2021-04-19T15:56:22Z,2021-04-19T15:56:22Z,,,,1771,374,,,,,,,,,,English,,,,,,,"Place: 6-9 CARLTON HOUSE TERRACE, LONDON SW1Y 5AG, ENGLAND Publisher: ROYAL SOC Type: Article",,,,,empathy; experience-dependent plasticity; fMRI; human-robot interaction; social cognition; social robotics,,,,,,,,,,,,,,,,,,,,,,,,,,,,,,,,,,,,,,,,,,,,,,,aneurocognitiveinvestigationoftheimpactofsocializingwitharobotonempathyforpain,a neurocognitive investigation of the impact of socializing with a robot on empathy for pain to what extent can humans form social relationships with robots in the present study we combined functional neuroimaging with a robot socializing intervention to probe the flexibility of empathy a core component of social relationships towards robots twentysix individuals underwent identical fmri sessions before and after being issued a social robot to take home and interact with over the course of a week while undergoing fmri participants observed videos of a human actor or a robot experiencing pain or pleasure in response to electrical stimulation repetition suppression of activity in the pain network a collection of brain regions associated with empathy and emotional responding was measured to test whether socializing with a social robot leads to greater overlap in neural mechanisms when observing human and robotic agents experiencing pain or pleasure in contrast to our hypothesis functional regionofinterest analyses revealed no change in neural overlap for agents after the socializing intervention similarly no increase in activation when observing a robot experiencing pain emerged postsocializing wholebrain analysis showed that before the socializing intervention superior parietal and early visual regions are sensitive to novel agents while after socializing medial temporal regions show agent sensitivity a region of the inferior parietal lobule was sensitive to novel emotions but only during the presocializing scan session together these findings suggest that a short socialization intervention with a social robot does not lead to discernible differences in empathy towards the robot as measured by behavioural or brain responses we discuss the extent to which longterm socialization with robots might shape social cognitive processes and ultimately our relationships with these machines this article is part of the theme issue from social brains to social robots applying neurocognitive insights to humanrobot interaction
Simulating empathic behavior in a social assistive robot,18,"De Carolis, Berardina; Ferilli, Stefano; Palestra, Giuseppe",MULTIMEDIA TOOLS AND APPLICATIONS,2017,journalArticle,,1380-7501,10.1007/s11042-016-3797-0,,"When used as an interface in the context of Ambient Assisted Living (AAL), a social robot should not just provide a task-oriented support. It should also try to establish a social empathic relation with the user. To this aim, it is crucial to endow the robot with the capability of recognizing the user's affective state and reason on it for triggering the most appropriate communicative behavior. In this paper we describe how such an affective reasoning has been implemented in the NAO robot for simulating empathic behaviors in the context of AAL. In particular, the robot is able to recognize the emotion of the user by analyzing communicative signals extracted from speech and facial expressions. The recognized emotion allows triggering the robot's affective state and, consequently, the most appropriate empathic behavior. The robot's empathic behaviors have been evaluated both by experts in communication and through a user study aimed at assessing the perception and interpretation of empathy by elderly users. Results are quite satisfactory and encourage us to further extend the social and affective capabilities of the robot.",2017-02,2021-04-19T15:57:02Z,2021-04-19T15:57:02Z,,5073-5094,22,4,76,,,,,,,,,,English,,,,,,,"Place: VAN GODEWIJCKSTRAAT 30, 3311 GZ DORDRECHT, NETHERLANDS Publisher: SPRINGER Type: Article",,,,,Affective computing; Empathy; Social assistive robots,,,,,,,,,,,,,,,,,,,,,,,,,,,,,,,,,,,,,,,,,,,,,,,simulatingempathicbehaviorinasocialassistiverobot,simulating empathic behavior in a social assistive robot when used as an interface in the context of ambient assisted living aal a social robot should not just provide a taskoriented support it should also try to establish a social empathic relation with the user to this aim it is crucial to endow the robot with the capability of recognizing the users affective state and reason on it for triggering the most appropriate communicative behavior in this paper we describe how such an affective reasoning has been implemented in the nao robot for simulating empathic behaviors in the context of aal in particular the robot is able to recognize the emotion of the user by analyzing communicative signals extracted from speech and facial expressions the recognized emotion allows triggering the robots affective state and consequently the most appropriate empathic behavior the robots empathic behaviors have been evaluated both by experts in communication and through a user study aimed at assessing the perception and interpretation of empathy by elderly users results are quite satisfactory and encourage us to further extend the social and affective capabilities of the robot
"Leveraging human-robot interaction in hospitality services: Incorporating the role of perceived value, empathy, and information sharing into visitors' intentions to use social robots",29,"de Kervenoael, Ronan; Hasan, Rajibul; Schwob, Alexandre; Goh, Edwin",TOURISM MANAGEMENT,2020,journalArticle,,0261-5177,10.1016/j.tourman.2019.104042,,"Social robots have become pervasive in the tourism and hospitality service environments. The empirical understanding of the drivers of visitors' intentions to use robots in such services has become an urgent necessity for their sustainable deployment. Certainly, using social androids within hospitality services requires organisations' attentive commitment to value creation and fulfilling service quality expectations. In this paper, via structural equation modelling (SEM) and semi-structured interviews with managers, we conceptualise and empirically test visitors' intentions to use social robots in hospitality services. With data collected in Singapore's hospitality settings, we found visitors' intentions to use social robots stem from the effects of technology acceptance variables, service quality dimensions leading to perceived value, and two further dimensions from human robot interaction (HRI): empathy and information sharing. Analysis of these dimensions' importance provides a deeper understanding of novel opportunities managers may take advantage of to position social robot-delivered services in tourism and hospitality strategies.",2020-06,2021-04-19T15:56:07Z,2021-04-19T15:56:07Z,,,,,78,,,,,,,,,,English,,,,,,,"Place: THE BOULEVARD, LANGFORD LANE, KIDLINGTON, OXFORD OX5 1GB, OXON, ENGLAND Publisher: ELSEVIER SCI LTD Type: Article",,,,,Artificial intelligence; Hospitality services; Human-robot interaction; Intention to use robots; Social robots,,,,,,,,,,,,,,,,,,,,,,,,,,,,,,,,,,,,,,,,,,,,,,,leveraginghumanrobotinteractioninhospitalityservicesincorporatingtheroleofperceivedvalueempathyandinformationsharingintovisitorsintentionstousesocialrobots,leveraging humanrobot interaction in hospitality services incorporating the role of perceived value empathy and information sharing into visitors intentions to use social robots social robots have become pervasive in the tourism and hospitality service environments the empirical understanding of the drivers of visitors intentions to use robots in such services has become an urgent necessity for their sustainable deployment certainly using social androids within hospitality services requires organisations attentive commitment to value creation and fulfilling service quality expectations in this paper via structural equation modelling sem and semistructured interviews with managers we conceptualise and empirically test visitors intentions to use social robots in hospitality services with data collected in singapores hospitality settings we found visitors intentions to use social robots stem from the effects of technology acceptance variables service quality dimensions leading to perceived value and two further dimensions from human robot interaction hri empathy and information sharing analysis of these dimensions importance provides a deeper understanding of novel opportunities managers may take advantage of to position social robotdelivered services in tourism and hospitality strategies
